id	date	text_type	title	text	url
ERA_NEWS_0018	2021-02-10	NEWS	European Year of Rail 2021	 The year 2021 has been declared the European Year of rail with the main goal of boosting rail as a sustainable, innovative, interconnected and intermodal, safe and affordable mode of transport in line with the objectives set out in the European Green Deal and the Sustainable and Smart Mobility Strategy.  The European Union Agency for Railways (ERA) is celebrating the European Year of Rail with a range of activities, including a series of online webinars that address the most pressing issue of transport today, the launch of the European Rail Safety Climate Survey (ERA-SCS) and – if circumstance allow – stakeholder conferences on railway safety and the future of ERTMS by the end of the year. Many other events and activities can be found on the official EYR 2021 website with more information on how to get engaged. Why not join the campaign and promote the greenest mode of transport to the rest of Europe?! ERA will participate in the European Year of Rail launch event on 29 March. Do not miss the debate on Rail Infrastructure, Connectivity and Territorial Cohesion! Find here more information. Related Links European Year of Rail – ERA Activities 	https://www.era.europa.eu/content/european-year-rail-2021_en
ERA_NEWS_0019	2021-02-18	NEWS	EUMedRail seminar on Human and Organisational Factors	 The EU Agency for Railways organised a seminar on 17 February on Human and Organisational Factors (HOF) in the scope of the EUMedRail project.  More than 100 participants from the Euromed and IPA projects as well as other international stakeholders took part in this seminar, which aimed to increase understanding on HOF methods and their integration to improve SMS and risk and change management.  Ms Yeo, from the EU Agency for Railways, made a brief introduction on the framework of the Safety Management System to manage risks, roles and responsibilities. She then reminded the specific requirements to RU (railway undertakings) and IM (infrastructure managers), which need respectively a safety certificate and a safety authorisation and are assessed by the NSAs or the EU Agency for Railways. Ms Yeo stressed that the directive on railway safety highlights the impact of human factors and human actions that could be a direct cause of an accident or incident should be carefully analysed. Her intervention concluded with some tools developed to integrate the HOF in the SMS, including the Management Maturity Model and the Safety Management system requirements for safety certification or safety authorisation.  Mr Penners, HOF expert from Infrabel, shared with participants the processes and methods to integrate HOF in the daily operation.  Ms Lagaize-Davoine, from the EU Agency for Railways, introduced the integration of HOF in risk assessment and change management stressing the responsibility of both IM and RU to ensure safe operations in each part of the system by implementing and monitoring risk control measures. She then presented the common safety methods on SMS requirements and the HOF requirements on risk assessment. Organisations shall identify and analyse operational, organisational and technical risks including those from human and organisational factors, shall fulfil the human factors requirements in all phases of the life cycle and demonstrate a systematic approach to integrate human and organisational factors within the safety management system. She provided to the audiences some examples of safety measures and afterwards proposed an exercise that encouraged discussions from the audience.  For further information of this event, please contact: EUMedRail@ERA.EUROPA.EU  	https://www.era.europa.eu/content/eumedrail-seminar-human-and-organisational-factors_en
ERA_NEWS_0020	2021-03-19	NEWS	Successful ENISA-ERA Conference on Cybersecurity in Railways	 Over two days, more than 600 participants joined virtually to hear about Policy, Standardisation and Certification, Research & Innovation, and Information Sharing & Cooperation. Detailed presentations shed light on how to improve the resilience of the railway system to cyber threats, with experts from the European Commission (DG CNCT & MOVE), the National Safety Authority (ESPF), CENELEC WG 26, Shift2Rail (TD 2.11 and 4SECURERAIL), UIC, ER-ISAC and UNIFE. At the end of the conference, the participants were of the opinion that topics for future conferences could include, among others: new technologies; cyber risk management for railways; cyber threat landscape; the update of Technical Specifications for Interoperability (TSI); cyber skills and training and cyber incident response. The success of this event demonstrates the advantages of the ERA-ENISA cooperation in the field of railway cybersecurity, and how railway stakeholders can benefit from the cross-fertilisation of both the cybersecurity and the railway regulatory framework. Find the takeaways of the conference here. The recording of the conference will be available soon on our dedicated event webpage. For any questions, you can use the contact us form on our website. 	https://www.era.europa.eu/content/successful-enisa-era-conference-cybersecurity-railways_en
ERA_NEWS_0021	2020-07-16	NEWS	ERA publishes biennial Report on Progress with Railway Safety and Interoperability in the EU	 Monitoring safety and interoperability of the Union railway system is one of the key tasks of the European Union Agency for Railways. The report published today is based on data for the reporting period 2018, and where available, for 2019. This report provides a thorough overview of the development of railway safety and interoperability in the European Union. It should facilitate evidence-based policy-making at EU level. European railways remain among the safest in the world with one passenger fatality occurring each 25 billion kilometers on average. Major accidents with more than five fatalities are becoming increasingly rare, 2018 being the first year since the late 1980s with no major railway accident reported. ERA’s Executive Director, Josef Doppelbauer however urges the sector: ”We can never afford to be complacent. Unlike the European aviation and maritime industries, railways still have not implemented a systematic and comprehensive EU-wide safety occurrence reporting scheme, which would enable not only to learn effectively from major accidents, but also from incidents without victims. Several areas in which safety has been stagnating recently, such as level crossing and railway workers safety, or rolling stock fires, would particularly benefit from wider information sharing. I invite all railway parties to be strongly committed to enhancing railway safety by rigorously applying a robust Safety Management System and by implementing a positive railway safety culture.” We notice a sound progress in railway interoperability concerning the alignment of operational frameworks in terms of rules, however only modest improvements are visible in making the railway assets interoperable. At border crossings the weaknesses in railway interoperability are most visible. In many areas, delays in the implementation of legal requirements in a few Member States consequently delay the interoperable deployment of railways in other countries, depriving them of the full benefits from the harmonised system. “We all need to enhance our efforts in particular in the area of railway data interoperability”, says Josef Doppelbauer: “high quality interoperable railway data are essential for European railways. I invite all parties involved to intensify their collaboration with the Agency.” The report geographically covers the 28 Member States as of end 2019. Since Cyprus and Malta do not have railway systems that are covered by the EU legislation, the Union railway system is constituted by 26 Member States. Download the report. For any questions, you can use the contact us form on our website. 	https://www.era.europa.eu/content/era-publishes-biennial-report-progress-railway-safety-and-interoperability-eu_en
ERA_NEWS_0022	2020-09-28	NEWS	ERA publishes COVID-19 Information Bulletin on Ventilation in Railway Vehicles	 The European Union Agency for Railways (ERA) supports the efforts of European railway companies to reduce the risk of spreading COVID-19 by providing expertise and by facilitating the international exchange of COVID-19 relevant information, experience and best practice. The Information Bulletin on Ventilation in Railway Vehicles gives detailed recommendations taking into account the main air distribution concepts applied in railway vehicles and drivers’ cabs today: natural ventilation, forced air ventilation systems - sometimes with air refresher devices, and air conditioning (Heating, Ventilation, and Air Conditioning - HVAC) systems. It provides detailed non-binding information related to ventilation of passenger trains to safeguard the health and safety of passengers, transport workers and staff, and to re-establish trust in rail services. 	https://www.era.europa.eu/content/era-publishes-covid-19-information-bulletin-ventilation-railway-vehicles_en
ERA_NEWS_0023	2020-09-04	NEWS	Successful Safety Leadership training at ERA	 Striving to improve safety culture in railways in the European Union, the Agency has developed a Safety Leadership Training. “Safety is a state of mind. Safety requires time and resources and above all dedication, from the top to the bottom. Let’s not leave anyone behind”, urges ERA’s Executive Director Josef Doppelbauer. European railway companies recognise the importance of a positive safety culture and a sound safety leadership. To ensure a large and efficient deployment of the training, the Agency has conceived a train-the trainer approach. After the COVID-19 confinement period, ERA restarted trainings at its premises in Valenciennes, France, following a strict regime of measures. For more information on these trainings, please write to us at safetyculture. You can find more information on safety culture on our dedicated website pages. For questions, contact us, selecting Railway Safety as a topic. 	https://www.era.europa.eu/content/successful-safety-leadership-training-era_en
ERA_NEWS_0024	2020-07-21	NEWS	COVID-19 Rail Protocol	 Railway Infographic For the safe resumption of railway operations in Europe, the European Union Agency’s for Railways (ERA), the European Commission and the European Centre for Disease Prevention and Control (ECDC) have developed operational guidelines with the COVID-19 railway protocol. It complements measures taken by the European Commission to support Member States in re-launching safe mobility and tourism across Europe. This protocol is a collaborative and dynamic process featuring regular information updates through dedicated information bulletins, providing detailed non-binding advice in specific topics identified suitable to safeguard the health and safety of passengers, transport workers and staff, or to re-establish trust in rail services. Work is ongoing. The good practice measures recommended in this protocol are not stand-alone solutions without alternative. However, if largely adhered to and applied in a harmonised manner, they will improve the international passenger experience with a single set of rules and conventions within the EU, while assisting operators of cross border services by ensuring coherent requirements across Member States. You can find more information on our dedicated COVID-19 Information Platform. For further questions, please contact COVID-RAIL@era.europa.eu 	https://www.era.europa.eu/content/covid-19-rail-protocol_en
ERA_NEWS_0025	2020-12-03	NEWS	The EUMedRail Steering Committee discusses the project plan for 2021	 The meeting kicked off with the welcome speech of the Executive Director of ERA. Dr. Doppelbauer stressed the important commitment of supporting railway safety and interoperability in the EUMedRail countries, the new role of the Agency as a rail authority in the EU and a Safety Management System based on risks, rules and behavior. The rapporteur of the EUYear of Rail 2021 in the European Parliament, Ms. Anna Deparnay-Grunenberg, emphasized railways for being a sustainable, innovative and safe mode of transport helping the EU to achieve climate neutrality by 2050. The EU Year of Rail 2021, she said, will praise rail as the sustainable mode of transport and fruitful discussions will follow to understand the needs to make the shift from road to rail. Improving digitalisation and interoperability, investments of rolling stock, accelerating the deployment of European train management systems (ERTMS) and promoting the use of cross-border night trains are some of the initiatives identified. The Secretary General of OTIF, Mr. Küpper, also intervened to stress the role of OTIF and the COTIF Convention to promote, improve and facilitate international traffic by rail. After these keynote interventions, the project officer, Mr. Ilyas Daoud, revised the actions undertaken in 2020, which due to the covid-19 pandemic and mobility restrictions had a mix format of physical and virtual meetings. The EUMedRail partners presented the latest initiatives implemented in the field of railways and explained the measures and protocol implemented to adapt the sector to the COVID-19 pandemic. During the meeting, the project partners had also the chance of providing additional comments to the evaluation on the Regional Transport Action Plan 2014-2020. The project manager, Mr. Peter Mihm, presented a proposal of activities envisaged for the years 2021 and 2022 including webinars, bilateral meetings ,seminars and as far as possible traineeships at ERA. The work plan for 2021 and 2022 considers actions in the field of Safety Management System through the promotion of safety operations and maintenance, institution capacity building, promotion of international railway transport and technical interoperability, involvement of the EUMedRail partners in the events organised by ERA and tailored assistance agreed with the countries. For further information on the EUMedRail project, please contact here. 	https://www.era.europa.eu/content/eumedrail-steering-committee-discusses-project-plan-2021_en
ERA_NEWS_0026	2020-07-16	NEWS	Report - Fostering the railway sector through the European Green Deal	 The report gives a general overview on the European Union Targets and European Green Deal and explains the main reasons why railway is the greenest mode of mass transport. It presents a strategy for a rail renaissance to foster the rail sector to achieve the climate goals of the Paris Climate Agreement. 	https://www.era.europa.eu/content/report-fostering-railway-sector-through-european-green-deal_en
ERA_NEWS_0027	2020-06-26	NEWS	‘Mechanism’ to safeguard Notified Bodies impartiality: New communication form   	 Under the provisions of this technical document, the ‘mechanism’* to safeguard NoBo impartiality, is required to address to the Agency communications of independent actions undertaken. To facilitate this task, the ‘mechanism’ to safeguard NoBo impartiality, can now submit online the information, using the communication form, available also from the Conformity Assessment section. *ISO/IEC 17065: 2012(E): A possible mechanism can be a committee established by one or more certification bodies, a committee implemented by a scheme owner, a governmental authority or an equivalent party. 	https://www.era.europa.eu/content/%E2%80%98mechanism%E2%80%99-safeguard-notified-bodies-impartiality-new-communication-form_en
ERA_NEWS_0028	2020-05-28	NEWS	Karima Delli and the rail freight transport sector call on the Commission and the  Member States to foster modal shift	 “We are then all committed to relaunch rail freight as far as possible. We look forward to building synergies between the different transport modes: maritime transport for heavy and long distances, railway transport across borders and along corridors, and road transport for the last miles” Following a first videoconference meeting which took place on Tuesday 5 May, Karima Delli, the chairwoman of the ‘transport and tourism’ committee of the European Parliament, together with the Executive Director of the European Union Agency for Railways (ERA) and the CEOs of the European rail freight transport companies members of the Rail Freight Forward Initiative, have decided to set up a new coalition of rail freight. While rail freight lies within the cleanest transport modes when it comes to transport of goods, fostering modal shift across the EU appears to be a matter of top priority. It is one of the solutions to comply with the ambitions of the Green Deal as well as our climate goals. The current polycrisis that affects the whole World has however had significant impacts on the overall economy, then on rail freight too. The sector needs to be supported to be able to survive this crisis and to meet our expectations on sustainability over the upcoming months, which could lead to an effective European green logistic chain. The rail freight coalition aims at working on the ways to encourage modal shift and rail freight, with the ambition to increase the modal share of rail freight in Europe from currently 18% to 30% by 2030 and beyond. It is then about reversing the current trend which has been tending to let rail freight down. The stakeholders have identified four working issues: Rail freight as a priority: Rail and road freight do not face the same costs and competition issues. The Council must resume work and conclude the discussions on the Eurocharging directive as quick as possible, in order to launch trialogues over the upcoming months. A whole discussion on competition between road and rail must be held at the top level. Rail freight has been key during the Coronavirus crisis, and will keep on being essential. The sector is however not a priority compared to rail passenger transport. The situation should be balanced in the future. Rail freight is international and the revision of the Rail Freight Corridors Regulation 913/2010 should lead to the respective governance structures. Need of economic and financial support: The sector must be incentivised to be able to overcome the current crisis. Economic and financial support should however be conditioned to ecofriendly/green investments (see below).Member States should also take measures on track access fees, to make them lower for rail freight operators while compensating infrastructure managers for the loss of revenue, where there are losses; Investments: There is a clear need to undertake massive investments (e.g. new traffic control systems) to strengthen and foster modal shift across the EU and the rail freight sector. They should be targeted on infrastructure: digitalisation and investments in new technologies will make possible to set up more capacity on tracks, especially on Rail Freight Corridors. Those investments must comply with the climate objectives, when it comes to infrastructures and technologies. Investments in rail freight is not an end in itself. Rail operators should also pay close attention to what they deliver. Digitalisation: To make rail freight as effective and green as possible, new technologies are one of the solutions, in terms of digitalisation, standardisation etc (e.g. digital European capacity planning). The use of new technologies must however comply with preservation of jobs as well as with strict data policies.   Delli Karima, Chairwoman of the ‘transport’ committee of the European Parliament Doppelbauer Josef, Executive Director of the European Union Agency for Railways (ERA) Bednárik Ivan, ČD CargoDebaisieux Nicolas, RailCoopDel Carmen Rincón María, RenfeDelorme Frederic, SNCFEngstrand Gustaf, TågföretagenFlore Sven, SBB CargoFoerst Clemens, RailCargoGiaconia Maria Annunziata, MercitaliaMandl Andreas, LTE GroupMaslikov Yuriy, MT GroupNikutta Sigrid, DBPauwels Geert, LineasSöderholm Ted, Green CargoStahl Dirk, BLSVozár Martin, ZSSK CargoWarsewicz Czesław, PKP CargoZenner Laurence, CFL CargoFeighan Conor, European Rail Freight Association (ERFA)Lochman Libor, Community of European Railway and Infrastructure Companies (CER) 	https://www.era.europa.eu/content/karima-delli-and-rail-freight-transport-sector-call-commission-and-member-states-foster_en
ERA_NEWS_0029	2020-04-08	NEWS	Temporary measures to be adopted by railway Notified Bodies for the Evaluation activities	 The exceptional circumstances and restrictions established by the vast majority of Member States to contain the coronavirus disease (COVID-19), are temporarily preventing NoBos from efficiently carrying out their planned evaluation activities. To support business continuity, mitigate the economic impact of the restrictions put in place and support stakeholders in the fulfilment of their legal duties and obligations, NB-Rail has issued, with the support of the Agency, the Recommendation for Use RFU-STR-704 for the remote performance of NoBo activities originally intended to be performed ‘on-site’. Read more on the NB-Rail website 	https://www.era.europa.eu/content/temporary-measures-be-adopted-railway-notified-bodies-evaluation-activities_en
ERA_NEWS_0030	2020-05-27	NEWS	4RP transposition deadline postponed to 31st October 2020	 In the light of the COVID-19 outbreak, some Member States have requested to postpone the transposition deadline of 16th June 2020. As part of the emergency measures adopted by the Commission in reaction to the extraordinary situation caused by the COVID-19 outbreak, Member States will be able to complete the process until 31 October 2020. The new EU Directive on the extension of the transposition periods has been published today, 27 May 2020, on the Official Journal of the European Union and will enter into force tomorrow, 28 May 2020. For any questions, you can use the contact us form on our website. 	https://www.era.europa.eu/content/4rp-transposition-deadline-postponed-31st-october-2020_en
ERA_NEWS_0031	2020-03-13	NEWS	Update on COVID-19 at ERA 	 Following the measures taken in the last 24 hours by the European Commission and by the national authorities to inhibit further spreading of COVID-19 the European Union Agency for Railways has recommended its staff to telework as per today, 13th MARCH 2020 at 11:59 until further notice. This enables the Agency to continue its activities and to serve its stakeholders. For any requests concerning this particular situation, you can use the contact us form on our website.   	https://www.era.europa.eu/content/update-covid-19-era_en
ERA_NEWS_0032	2020-04-07	NEWS	First Safety Culture Series guidance now available	 To provide support to the European railway sector to effectively implement the complex concept of safety culture, the EU Agency for Railways has decided to publish a series of concise guidelines under a new sequence called “safety culture series”. The first volume of this guidance, Introduction to the European Railway Safety Culture Model, is published today. The aim of this first guide is to explain the European railway safety culture model as a tool to understand how safety culture develops and can be influenced. The target audience is wide, covering regulators, senior managers, rail safety managers, supervisors, researchers and all other individuals interested in the concept of safety culture. The European railway safety culture model is an effective tool to support all the players to contribute to improving railway safety. It is the result of the work of a dedicated task force with professionals from diverse backgrounds representing different types of organisations and from a variety of Member States. The model has been successfully tested and practically implemented to evaluate and improve railway safety culture. Safety is not only about regulation, rules and procedures. Safety is about a living and collective commitment. By developing useful instruments to support the sector, the European Union Agency for Railways is demonstrating its engagement to develop a positive safety culture. However we need the commitment of all players to achieve a sustainable and safe performance in the Single European Railway Area. You can find more information on safety culture on our website where you can also download the guidance. For questions, contact us, selecting Railway Safety as a topic. 	https://www.era.europa.eu/content/first-safety-culture-series-guidance-now-available_en
ERA_NEWS_0033	2020-03-17	NEWS	Update on COVID-19 at ERA	 We invite you to watch the video message from our Executive Director on YouTube. For any requests concerning this particular situation, you can use the contact us form on our website. 	https://www.era.europa.eu/content/update-covid-19-era-0_en
ERA_NEWS_0034	2020-03-30	NEWS	European Commission moves to support pragmatic solutions	" ""Member States have informed the Commission about difficulties to renew certain licenses or certificates for professional carriers, including vehicles and vessels certificates or transport workers, due to public measures that have become necessary in view of the COVID-19 outbreak."" Read more about the response form the European Commission in the Note of the Director-General: Exceptional measures in transport to deal with COVID-19; Inability to comply with certain provisions of EU legislation.   "	https://www.era.europa.eu/content/european-commission-moves-support-pragmatic-solutions_en
