id	date	text_type	title	text	url
ERA_NEWS_0001	2025-12-14	NEWS	Call for expressions of interest (CEI) to establish a list of Independent experts to provide expertise to the European Union Agency for Railways in the field of safety.	 The objective of this call for expressions of interest (CEI) is to set up a list of independent external experts to provide expertise to the European Union Agency for Railways in the domain of safety. The list resulting from this notice is valid from dispatch of this notice and for maximum five years (valid until 14 December 2025). Interested parties may submit an application at any time prior to the last three months of validity of the list. Read more 	https://www.era.europa.eu/content/call-expressions-interest-cei-establish-list-independent-experts-provide-expertise-1_en
ERA_NEWS_0002	2021-10-25	NEWS	Meet ERA at SIFER 2021	 The European Union Agency for Railways (ERA) participates to the next SIFER exhibition in Lille* from 25 to 27 October 2021. Staged every two years since 1999, SIFER, France's only B2B international industry exhibition, brings together suppliers and manufacturers of the very latest in railway technology, products and services aimed at meeting the complex needs of main line and urban networks. As well as providing a gateway to one of Europe's major markets, SIFER also helps participating companies to pursue export opportunities. As the showcase event for France's dynamic railway supply industry, it sets the scene for wide-ranging and productive exchanges on the future of the industry, and for the establishment of strategic contacts and relationships. Come and visit ERA stand 2/640 ! *Lille Grand Palais Exhibition Centre, 1 boulevard des Cites Unies, 59031 Lille 	https://www.era.europa.eu/content/meet-era-sifer-2021_en
ERA_NEWS_0003	2021-07-28	NEWS	ERA is looking for vehicle authorisations consultancy support	 Please be informed that the Agency has published a call for tenders to provide consultancy support to the contracting authority on vehicle authorisations applications. The procurement documents are available here. The limit to submit proposals is Thursday 9 September. 	https://www.era.europa.eu/content/era-looking-vehicle-authorisations-consultancy-support_en
ERA_NEWS_0004	2021-09-08	NEWS	Benefits of EU harmonised rules and procedures to improve railway safety	 The event gathered more than 150 participants from authorities and railway operators of the southern Mediterranean region, namely from Algeria, Egypt, Israel, Jordan, Morocco, Palestine1 and Tunisia, including a high number of international guests from the Eastern Partnership, the Western Balkans and Turkey, South America – among other key stakeholders: the  Intergovernmental Organisation for International Carriage by Rail (OTIF) and the International Union of Railways (UIC).  The main objectives of the event were to present the links between safety management system (SMS) requirements and the technical specification for interoperability (TSI OPE), give an overview of functional and technical specifications of the TSI OPE (relating to staff, trains and train operations), underline the links between EU Regulations and international railway law, discuss company rules and standards and their compliance with TSI OPE, and reflect on the roles and responsibilities of railway undertakings (RUs) and infrastructure managers (IMs) to ensure safe operations during normal, degraded but also in emergency situations.   On the first day, discussions focused on harmonised rules and procedures of the SMS in accordance with fundamental operating principles of TSI OPE, the importance to develop a competence management system for staff performing safety-related tasks (such as train driving, train preparation, authorisation of train movement), and the supporting documentation (e.g. driver’s rule book, route book).  On the second day, participants exchanged a series of reflection on the parameters to be checked to ensure vehicle and train compatibility over the route intended for operation, and the contribution of railway standards developed by the sector (notably on safety of load and passengers among other topics). The seminar eventually addressed some of the upcoming legal changes to the Convention concerning International Carriage by Rail (COTIF), regarding safety regulation and safety management.      1. This designation shall not be construed as recognition of a State of Palestine and is without prejudice to the individual positions of the Member States on this issue. 	https://www.era.europa.eu/content/benefits-eu-harmonised-rules-and-procedures-improve-railway-safety_en
ERA_NEWS_0005	2021-10-07	NEWS	Positive Safety Culture to Bring European Rail Safety to Next Level	 Rail officials honour the importance of the European Rail Climate Survey (ERA-SCS), the first pan-European sectoral survey on safety perception, as hallmark for a positive culture and important step for harmonising and improving rail safety in Europe The central role of railways for future sustainable European transport was acknowledged upon the arrival of the Connecting Europe Express to its final destination at Paris Gare de l’Est by the many officials present, celebrating the European Year of Rail 2021. The European Union Agency for Railways (ERA), together with SNCF Chairman and CEO Jean-Pierre Farandou, Henrik Hololei, Director-General for Mobility and Transport at the European Commission, and the Secretary-General of the European Transport Workers Federation (ETF) Livia Spera, used the occasion to promote the European Rail Climate Survey (ERA-SCS), a pan-European initiative to collect safety perception from the employees in the rail sector. While the survey is open until 31 October 2021, the Agency and its partners managed to obtain more than 43.000 responses from European rail workers since its launch in early 2021. The survey is the first of its kind to be launched at European level to an entire industry sector. Its findings will be used to improve rail safety in Europe. “The more answers to the ERA-SCS, the better the quality of the data and the higher relevance of the following analyses - so I count on the railway professionals in Europe to give us their honest opinion”, asserted Henrik Hololei. “This is a good step towards making sure workers’ voices are heard as they are the only ones who know the reality of their workplace. Health and safety at work is a right, not a privilege. Therefore ETF is pleased to have been part of the ERA-SCS”, said ETF General Secretary Livia Spera. SNCF Chairman and CEO Jean-Pierre Farandou added: “Safety has always been the top priority for the SNCF group. We are proud to have contributed close to 10.000 responses to this important pan-European survey.” ERA Executive Director Josef Doppelbauer concluded: “Safety is the essential precondition for successful rail business. The survey is still open until 31 October – so I urge all rail professionals in Europe to fill in the survey today!”   About the European Rail Safety Culture Survey (ERA-SCS) era-scs In order to further improve safety in the European rail system, the Agency is launching a unique safety perception survey open to all rail professionals working in the European Union and in EFTA states: the European Rail Safety Climate Survey (ERA-SCS). It is an online survey hosted on the EUSurvey platform, accessible in 22 European languages on smartphones, tablets and computers. The core questionnaire, elaborated with the support of experts from all trades of the railway system, is made up with a set of 48 safety statements aligned with the European Railway Safety Culture Model. Access the ERA-SCS here For more info on the ERA-SCS, please click here Download a PDF of this press release press_release_7_october_v02.pdf Download here (217.7 KB) 	https://www.era.europa.eu/content/positive-safety-culture-bring-european-rail-safety-next-level_en
ERA_NEWS_0006	2021-07-27	NEWS	Consultation on the 2022 package revision of the TSI relating to telematics applications for passengers (TAP TSI)	" The draft recommendation or report and supporting documents for the proposal on the website. In compliance with Article 5 of the Agency Regulation, this proposal was drafted by the Agency with the support of representatives of national safety authorities and sector organisations. This consultation is specifically aimed at having your comments on the overall impact of the recommendation from your perspective as defined in the above mentioned articles. The proper conduct of the consultation procedure envisages the collection and further processing of your personal data. The European Union Agency for Railways complies with the European legislation on personal data protection. In this regard, it is kindly requested to read carefully the Privacy Statement before submitting your opinions. The submission of comments is open between the 01/08/2021 and the 31/10/2021. Please use this template and send it with your comments by email to the functional mailbox (""ERA-REC-122"" followed by ""@era.europa.eu""). "	https://www.era.europa.eu/content/consultation-2022-package-revision-tsi-relating-telematics-applications-passengers-tap-tsi-0_en
ERA_NEWS_0007	2021-07-27	NEWS	Consultation on the 2022 package revision of the TSI relating to telematics applications for freight (TAF TSI)	" The draft recommendation or report and supporting documents for the proposal on the website. In compliance with Article 5 of the Agency Regulation, this proposal was drafted by the Agency with the support of representatives of national safety authorities and sector organisations. This consultation is specifically aimed at having your comments on the overall impact of the recommendation from your perspective as defined in the above mentioned articles. The proper conduct of the consultation procedure envisages the collection and further processing of your personal data. The European Union Agency for Railways complies with the European legislation on personal data protection. In this regard, it is kindly requested to read carefully the Privacy Statement before submitting your opinions. The submission of comments is open between the 01/08/2021 and the 31/10/2021. Please use this template and send it with your comments by email to the functional mailbox (""006REC1128"" followed by ""@era.europa.eu""). "	https://www.era.europa.eu/content/consultation-2022-package-revision-tsi-relating-telematics-applications-freight-taf-tsi-0_en
ERA_NEWS_0008	2021-06-17	NEWS	ERA Executive Director: “We see some light at the end of the tunnel”	 “We see some light at the end of the tunnel”, assured Mr Doppelbauer, while explaining that “COVID will change the travel patterns” in the coming years. Our Executive Director also stressed that “we have a patchwork of national [railway] systems, we need to transform this patchwork into an efficient European railway system.” Watch Mr Doppelbauer speech in the European Parliament (speech between 17:36:38 and 17:48:03 / Q&As between 18:08:37 and 18:18:25): 	https://www.era.europa.eu/content/era-executive-director-%E2%80%9Cwe-see-some-light-end-tunnel%E2%80%9D_en
ERA_NEWS_0009	2021-06-16	NEWS	Promoting of best practice in accident and incident investigation in the EuroMed region	 On 15 and 16 June, representatives from national authorities and railway operators of Egypt, Israel, Morocco, and Tunisia took part in international workshops organised in the scope of the EUMedRail project. The aim was to discuss the setting-up of a permanent and independent investigation body as well as how to improve national procedures taking into account of EU experiences.  The workshops gave an opportunity to address topics such as accident investigation starting from the notification of such event, via occurrence reconstruction, analysis of safety management systems and identification of root causes and contributory factors, till the issuing of safety recommendations and elaboration of investigation reports.  ERA underlined the benefits of a harmonised framework and approach to accident and incident reporting, with a view to share lessons learnt and address similar safety risks in the future.  National investigation bodies from Belgium, Finland and the Netherlands illustrated, with a series of study cases, how state of the art investigations are carried out and informed how collection and processing of evidence during on-site examinations are carried out, informed about the analysis of safety management systems performance and the incidence of human and organisational factors, besides the issuing and follow-up of safety recommendations.    Participants also reflected on the cooperation between national safety authorities and investigation bodies at EU level, and examined the possibility to set up a regional network to continue the exchange of information, to share good practice in data collection, and closely monitor safety developments. 	https://www.era.europa.eu/content/promoting-best-practice-accident-and-incident-investigation-euromed-region_en
ERA_NEWS_0010	2021-07-13	NEWS	What does ERA do?	 The 2021-2023 programming period marks the full-fledged implementation of the new tasks arising from the technical pillar of the 4th Railway Package together with the regular tasks in the field of railway safety & interoperability. But what does it concretely mean? To have an overview of the structure of the Agency’s multi-annual activities, we designed dedicated infographics, explaining our values, goals, KPIs and activities. Click here to discover these infographics 	https://www.era.europa.eu/content/what-does-era-do_en
ERA_NEWS_0011	2021-05-20	NEWS	ERA report on fostering the railway sector through the European Green Deal - part 2 freight	 This report will serve as a contribution to the future initiatives that the European Commission will push forward to increase and better manage railway capacities. 	https://www.era.europa.eu/content/era-report-fostering-railway-sector-through-european-green-deal-part-2-freight_en
ERA_NEWS_0012	2021-06-03	NEWS	Study: rail travel remains safer than car travel, even during the pandemic	" Available information suggests clearly that European citizens are concerned about travelling by train and other forms of collective transport during the COVID-19 pandemic. Many people seem to have switched from using trains to travelling by car in 2020 and 2021. As always in times of uncertainty, mathematical models based on available evidence can help to estimate the actual risks and add to more objectivity. That is why ERA develops in this study a first model to estimate the COVID-19 risk when travelling long-distance by train in order to provide the necessary knowledge that can be used by decision makers and the public. “Most human beings, including decision makers, seem to have difficulty to estimate and manage risks […]When used correctly, the model can help to make the situation more tangible, yet controllable. However it is important to carefully take into account all assumptions, evidences and boundary conditions”, says Torben Holvad, ERA’s editor of the study. The study confirms that the overall fatality risk travelling by public transport is a multiple higher during the COVID-19 pandemic than in other times. However, individual car travel currently remains more dangerous than rail, taking into account the overall safety risk, also under the COVID-19 pandemic. In the context with vaccines being rapidly distributed, the overall picture is even clearer in terms of the ranking of overall fatality risk ranking between rail and car. Sensitivity testing, e.g. including more infectious new virus variants, has confirmed the robustness of the results that can be obtained by using the model. When safety measures are in place, like masks and distancing, cleaning and discouraging infected people to travel, the risk of being infected when travelling by train can be significantly reduced. ""During this pandemic the Agency is supporting the railway sector by giving technical advice, e.g. with the COVID-19 Rail Protocol and the COVID Ventilation Bulletin published in 2020 and it continues to closely monitor the situation in permanent contact with national authorities, the European Commission and its stakeholders”, says Josef Doppelbauer, Executive Director of ERA. “In order to reach our climate goals and to avoid massive congestion problems when citizens continue to travel by car after the pandemic, it is essential to rebuild trust in railways and make rail the first choice."" This is the reason why ERA proposes a joint Post-Pandemic Rail Recovery Campaign, to be developed together with the European Commission and European sector organisations. In the European Year of Rail, this initiative would help to restore trust and promote both rail passenger and freight transport as currently the most sustainable mode of transport. About the EU Agency for Railways The European Union Agency for Railways was established in Valenciennes (offices) and Lille (meeting facilities) in 2004. Its 170 employees represent more than 22 European Member States and speak multiple languages. ERA has been providing EU Member States and the European Commission with technical assistance in the development and implementation of the Single European Railway Area. This comprises enhancing technical interoperability and harmonising rules, promoting simplified access for customers, developing a common approach to safety and safety culture, advising on telematics applications and ERTMS (European Rail Traffic Management System), monitoring National Safety Authorities and Notified Bodies and facilitating the exchange of information between the railway actors in Europe. Since 16th June 2019 the EU Agency for Railways is mandated to issue single safety certificates and vehicle (type) authorisations valid in multiple European countries and to ensure an interoperable European Rail Traffic Management System. The purpose of these activities is expressed by the slogan “Making the railway system work better for society.” "	https://www.era.europa.eu/content/study-rail-travel-remains-safer-car-travel-even-during-pandemic_en
ERA_NEWS_0013	2021-04-26	NEWS	Risk mitigation measures to resume transport of semi-trailers on pocket wagons in Denmark	 Following the 13.01.2021 incident on the Great Belt Bridge in Denmark, which happened at the same location as the severe accident of 02.01.2019, the Danish National Safety Authority imposed immediate measures which in practice have stopped the transport of semi-trailers on pocket wagons. Understanding the impact this ban has on rail freight transport companies and the need to urgently find solutions, the European Union Agency for Railways established a JNS Urgent Procedure Task Force. This Task Force aimed at identifying short-term risk mitigation measures in order to resume as soon as possible the transport of semi-trailers on pocket wagons on the Danish network and in particular on the Great Belt bridge. (more information: Joint Network Secretariat (JNS) Urgent Procedure and Normal Procedure) The Task Force, coordinated by ERA, was composed of representatives from the national safety authorities of Denmark, Sweden, Germany and The Netherlands as well as experts from the railway sector. The Task Force had its kick-off meeting on 04.02.2021 and concluded its work with the following outcome: read more. 	https://www.era.europa.eu/content/risk-mitigation-measures-resume-transport-semi-trailers-pocket-wagons-denmark_en
ERA_NEWS_0014	2021-05-25	NEWS	ERA cloud migration campaign: Your collaboration is needed	 The Agency is upgrading its IT environment to a new cloud version: this will improve our future professional collaboration. ERA cloud migration campaign: Your collaboration is needed We ask you to upgrade your ERA Profile. Please click on the ‘Accept Invitation’. You will be directed to an automated process to upgrade contact details.  In case you encounter any difficulties, you have the following possibilities: If you are a member of an ERA workgroup or network, please write to the chairman of your workgroup. If you are not a member of an ERA workgroup or network, you can communicate with us via the Contact us page on our website. We sincerely apologise for any inconvenience caused. Kind regards, ERA ICT - Communication Team  	https://www.era.europa.eu/content/era-cloud-migration-campaign-your-collaboration-needed_en
ERA_NEWS_0015	2021-05-28	NEWS	EUMedRail workshop on safety certification and supervision	 The purpose of the event was to reflect on how railway companies can demonstrate that they have established a functional safety management system, and how safety authorities can check and monitor the effectiveness and performance of such systems, as required by EU legislation.  The first day focused on safety certification and informed about the requirements laid down in EU regulations on railway safety management systems and the defined harmonised procedures to obtain from European authorities a safety certificate, as a prerequisite, to operate on the railway network in the European Union. ERA presented the requirements structured in a Plan Do Check Act (PDCA) cycle and explained the overall safety assessment process, also supported by ERA guidance documents on safety certification: from the application submitted by railway companies, the role and task of assessors, and the assessment till the decision taken, including the conditions applicable for the renewal, modifications, restrictions or revocations of safety certificates.  The French (EPSF) and Finnish (Traficom) national safety authorities reported on their experiences with issuing safety certificates and highlighted the benefits of the new EU legal regime, introduced under the 4th railway package. Specific attention had been given to the advantages of harmonised procedures, but also to the challenges posed by some requirements (e.g.  the integration of human and organisational factors or the development of a positive safety culture). The Ministry of Transport from Israel explained that a comparable safety certification scheme had been introduced in Isrel, and informed about the steps and processes used to certify, since 2018, the safety management system of its national railway operator, Israel Railways (ISR).  On the second day, experts of ERA and national authorities described supervision as a key process to ensure the effective application of railway safety management systems, and pointed out the need for national safety authorities to design and implement a comprehensive strategy to supervise railway companies. The purpose of this strategy is to make sure railway companies effectively apply their safety management system provisions on a continuous basis during the period of validity of their safety certificates.  To do so, ERA explained the way national safety authorities develop their strategies and implement subsequent plans addressing major railway risks, referring to some key principles such as proportionality, consistency, transparency, accountability, or cooperation to ensure sound and fair decision making.   The Belgian national safety authority (SSICF/DVIS) provided an overview of the different supervision techniques used, from operational controls, on-site inspections to system audits, highlighting the need to go beyond compliance, and drive railway companies towards more efficiency and efficacy of their safety management systems.  The Ministry of Transport from Tunisia reported on some of the tasks carried out to regulate safety, and to monitor the performance of its national operator, SNCFT, through indicators. Debates with participants focused on the need to strengthen safety management systems, create safety authorities in the region and foster cooperation with the EU and between partners of the region. Guidance on safety certification and supervision - visual 	https://www.era.europa.eu/content/eumedrail-workshop-safety-certification-and-supervision_en
ERA_NEWS_0016	2021-03-31	NEWS	For women’s eyes only - Interested in a career in railways?	 Who: women only  What: a one-on-one conversation with a female ERA staff member for a maximum of 15 women as a pilot (first come, first served) When: 15-20 minutes in the course of May/June Where: online via MS Teams More information: Women in Transport - EU Platform for change Registration CLOSED 	https://www.era.europa.eu/content/women%E2%80%99s-eyes-only-interested-career-railways_en
ERA_NEWS_0017	2021-03-20	NEWS	Publication of a white paper on Cybersecurity in Railways	 During the ENISA-ERA online conference on Cybersecurity in Railways, Laurent Cebulski, Managing Director of EPSF, the French National Safety Authority, announced a White Paper on how cybersecurity is considered by the railway sector in France. A Working Group composed of EPSF, ANSSI, the French Cybersecurity Agency, SNCF Réseaux, SNCF Voyageurs and the EU Agency for Railways has developed this White Paper to investigate how both the French/EU railway regulatory framework and the French/EU cybersecurity framework influence the measures to be taken to tackle cybersecurity in railways. 	https://www.era.europa.eu/content/publication-white-paper-cybersecurity-railways_en
