id	date	text_type	title	text	url
EASO_NEWS_0095	2016-12-06	NEWS	Two new studies highlight the significant contribution of EU Agencies to citizens and administrations	" The 45 EU Agencies and Joint Undertakings make a vast contribution to the economic and political development of the European Union according to two new studies presented today during the EU Agencies Forum at the European Parliament. The studies highlight that while the EU Agencies represent less than 0.8% of the EU’s annual budget their contribution has widespread impact at citizen, industry and policy level. The first study analyses the cost-effectiveness of the seven EU Agencies operating to support the Internal Market, and how they reduce the overall costs to taxpayers. The second study focuses on the contribution of 44 Agencies and Joint Undertakings to the Europe 2020 Strategy and the Juncker Commission Agenda.The studies will be discussed today and tomorrow during the first EU Agencies Forum at the European Parliament. Vice-President of the European Parliament, Mairead McGuinness and Kristalina Georgieva, Vice-President of the European Commission, are speakers at the event.  António Campinos, Executive Director of the European Union Intellectual Property Office (EUIPO) which is currently Chair of the EU Agencies Network, said: “The EU Agencies are the familiar face of the EU for many Europeans, delivering essential services on the ground for a relatively small proportion of the overall EU budget - less than 0.8%, to be exact. In other terms, they cost €1.23 euros per EU citizen. The cost benefit ratio is hence very positive, and as the EU Parliament study has shown, agencies save national administrations many millions every year, by delivering synergies and preventing duplication of efforts in each Member State.""  Agencies are cost effective and save moneyOverall, the 2015 budget of the EU Agencies represents less than 0.8% of the EU’s annual budget (about €1.2 billion), while creating significant efficiencies and delivering value for EU citizens across a wide range of policy areas, according to a report by Deloitte (link). A second report commissioned by the European Parliament estimates that it would cost Member States up to €200 million a year to assume the tasks currently done by just seven of the 45 agencies1 (link).Agencies are close to EU citizens and businesses As well as supporting the top political priorities of the European Union, EU Agencies play an important role in many other aspects of the everyday life of citizens: in disease prevention and control, security and defence, education and knowledge, stability of the financial systems, and in the fields of digital connectivity or transport, among others. In 32 cities across 24 Member States, EU Agencies work to improve the EU industry and citizens’ lives in many ways. For example:Frontex, the European Border and Coastguard Agency, currently deploys some 1 200 officers at EU’s external borders and has helped to rescue more than 89 000 people at sea so far this year;The European Asylum Support Office currently deploys over 300 staff in around 20 locations in Italy and Greece. They are working to support the implementation of the EU Relocation Programme and EU-TR Statement. EASO has an important role in better managing the Common European Asylum System;In 2015, Europol, the EU’s law enforcement agency, supported more than 40,000 investigations against terrorism and serious crime; The EU’s Intellectual Property Office’s study on the economic contribution of Intellectual Property Rights shows that IPR intensive industries in the EU now support directly or indirectly 38% of jobs and 42% of the EU’s GDP; Since 2010, the European Institute of Innovation & Technology (EIT) has created Europe’s largest innovation community, helped set up 32 innovation hubs across Europe, and supported the creation of more than 200 innovative start-ups and entrepreneurship training for 2,000 students and graduates;From 2014-2020 the Bio-based Industries Joint Undertaking is administering €3.7bn investments in bio-based innovation and will be funding more than 200 cooperative projects through cross-industry clusters;The EMCDDA (EU drugs agency in Lisbon), monitors over 560 new psychoactive substances through an EU Early Warning System. Where required, it assesses the risks of these substances to public health in Europe;The European Medicines Agency has recommended over 1000 new medicines for the treatment of patients. In addition to monitoring approved medicines, it also addresses the challenges holding back the development of new medicines, including new antibiotics.NOTE FOR EDITORSThe two studies on EU Agencies and Joint-UndertakingsThe first study on “The Cost of Non-Agencies with Relevance to the Internal Market” was requested by the Budget Committee of the European Parliament and prepared by the Centre for Strategy & Evaluation Services (link). It shows that the Agencies reduce the overall costs to taxpayers. This report is a snapshot covering just seven agencies: The European Union Intellectual Property Office (EUIPO);The European Aviation Safety Agency (EASA); The European Medicines Agency (EMA);The European Chemicals Agency (ECHA);European Banking Authority (EBA);The European Securities Markets Authority (ESMA);The European Insurance & Occupational Pensions (EIOPA).The European Banking Authority (EBA); The European Securities and Markets Authority (ESMA);The European Insurance & Occupational Pensions (EIOPA). The report shows that it is significantly more cost effective to perform a task once at EU level than to replicate it 28 times at national level.  The second study on “How do EU Agencies and Bodies contribute to the Europe 2020 strategy and to the Juncker Commission Agenda?” (link) was commissioned by the EU Agencies Network from the consultants Deloitte. It looks at how the EU agencies and bodies contribute to the Europe 2020 strategy and the Juncker Agenda. The EU Agencies Network The 45 decentralised Agencies and Joint Undertakings of the EU closely interact and cooperate within the EU Agencies Network, a Pan-European network, set up by the Heads of EU Agencies, as a collective voice for the Agencies to coordinate, exchange information and agree common positions of shared interest.For more informationFor more details about the Forum, see the Agenda.Follow the EU Agencies and the event on Twitter via #EUAgencies and #euagenciesforumClick here and find out more about how the 45 EU Agencies and Joint Undertakings.Watch videos about the EU Agencies on YouTube here.Press contactsDorottya VannaiMobile: +34 671 61 45 88Tel: +34 965 137 136Dorottya.VANNAI@ext.euipo.europa.eu Ruth McDonald Mobile: +34 606 157 278Tel: +34 965 13 8934Ruth.MCDONALD@euipo.europa.eu_______1The European Union Intellectual Property Office (EUIPO); The European Aviation Safety Agency (EASA); The European Medicines Agency (EMA); The European Chemicals Agency (ECHA); The European Banking Authority (EBA); The European Securities Markets Authority (ESMA); The European Insurance & Occupational Pensions (EIOPA). "	https://easo.europa.eu/news-events/two-new-studies-highlight-significant-contribution-eu-agencies-citizens-and
EASO_NEWS_0096	2016-12-08	NEWS	EASO Guidance on reception conditions: operational standards and indicators	 PR 26/2016EASO has issued the Guidance on reception conditions: operational standards and indicators. This Guidance represents one of the key measures identified by the European Agenda on Migration for the field of reception. The Guidance focuses on the provision of material reception conditions, notably on the provision of housing, food, clothing, health care, non-food items as well as a daily expenses allowance. Moreover, it addresses aspects such as information provision and counselling as well as training of staff working in national reception systems.The standards included in the document reflect existing and commonly agreed practice across EU Member States, as well as good practices identified across the EU. As such, the Guidance represents a first step and effort to facilitate the application of certain core provisions of the Reception Conditions Directive (RCD). Most importantly, the Guidance has been developed for the regular functioning of the reception system. Situations falling under an emergency framework, such as for example the use of the provisions of Article 18(9) RCD on emergency housing, fall outside the scope of this Guidance. Further standards and indicators on specific provisions of the RCD will be developed by EASO in 2017.  The development process of the Guidance followed a consultative approach, aiming at gathering the broadest possible spectrum of expertise from Member States as well as other relevant actors in the field of reception. The draft document was developed by a working group of experts from EU Member States while counting with the support of a reference group consisting of the European Commission, the Fundamental Rights Agency and the United Nations High Commissioner for Refugees. Moreover, members of the EASO Consultative Forum were invited to provide their views on the document. Lastly, all 28 members of the EASO Network of Reception Authorities were invited to provide their input to the document prior to its adoption by the EASO Management Board at its 22nd Meeting in September 2016.The Guidance is available in English language on the EASO website at: https://www.easo.europa.eu/practical-tools.The document is currently being translated into 22 EU languages, which will be made available on the organisation’s website in the coming months. Any further information on EASO may be obtained by contacting Mr. Jean-Pierre Schembri on the following e-mail address: jean-pierre.schembri@easo.europa.eu  (follow us live on twitter @EASO).  	https://easo.europa.eu/news-events/easo-guidance-reception-conditions-operational-standards-and-indicators
EASO_NEWS_0097	2016-12-22	NEWS	EASO to further enhance its operational support to Italy in 2017	 EASO’s support for Italy will continue and shall be enhanced in the course of 2017. EASO and Italy have today signed a single Operating Plan, encompassing all technical and operational assistance to Italy. Support activities foreseen include: support on relocation, supporting and enhancing identification and assistance to vulnerable applicants, especially with regards to unaccompanied minors and support with handling outgoing Dublin take charge requests.The new plan will be implemented over a period of 12 months, from January 2017 until December 2017. For the first time, the new agreement combines all the support measures and operational activities of EASO to Italy into one single Operating Plan, thus heightening the cooperation between the Agency and Italian authorities.With the Operating Plan, EASO will further develop its operation support to Italy by responding to particular pressure on its asylum and reception systems and sustain the full implementation of the EU Asylum Acquis. EASO’s support outlined in the agreement includes mainly: support with information and registrations of potential applicants; support with handling outgoing Dublin take charge requests; strengthening reception capacity especially with regards to unaccompanied minors; support in the professional development of the staff of Department of Civil Liberties and Immigration, within the Italian Ministry of Interior, as well as in activities in the field of COI. Within this context, EASO will deploy experts and interpreters to Italy and provide the necessary operational logistic and administrative support.Within the rapidly evolving situation in Italy and upon agreement with the Italian authorities, EASO will adjust its intervention providing appropriate support to address emerging needs.BackgroundEASO support to Italy dates back to June 2013. Anticipating the implementation of the new European Asylum Package, while facing large fluctuations in the number of arrivals of immigrants, together with the need of keeping high standards in its asylum and reception processes, have motivated Italy to ask EASO for assistance in enhancing its Asylum and Reception Systems. In this context, following a request made by Italy, in June 2013, the EASO Executive Director decided to render Special Support to Italy using the joint expertise of EASO and Member States. The first EASO Support Plan for Italy ran until December 2014, and focused on a number of prioritised areas, such as: data collection and analysis, Country of Origin Information (COI), Dublin system, reception system and emergency capacity, and training of independent judiciary.As a result of the support provided by EASO under the first Support Plan during 2013-2014, Italy managed to reinforce parts of its international protection and reception system. Italian staff has been trained and Italy developed its COI capacity. Moreover, significant progress was achieved in terms of increasing Italy’s capacity for reception and registration of applicants for international protection, as well as their preparedness and reaction capabilities.Italy, as an EU Member State at the external border, on the southern Mediterranean migration route, continues to be under serious migratory and refugee pressure. The request for continued support by EASO was inspired by Italy’s will to ensure sustainability of the good results achieved by EASO through the measure contained in the Operating Plan for Italy so that the current and future challenges can be adequately addressed. On 11 March 2015, a Special Support Plan (SSP) for the provision of technical and operational assistance to Italy was signed and extended until 31st of December 2016.In addition, EASO signed on the 12 December 2015 the EASO Hotspot-Relocation Operating Plan (HROP) to Italy for the provision of information, support in registration, identification, fingerprinting, further referral to the international protection procedure, as appropriate, and case preparation of the asylum files, especially in the context of Dublin procedures. Through HROP, EASO has provided support through all stages of relocation procedure, from disembarkation until decision drafting, and was responsible for more than 90% of all registrations of applications for international protection in view of relocation in Italy. This Plan was extended over time until 31st of December 2016.In 2017, EASO will continue to implement its role as mandate by the EU Institutions and the respective adopted framework, including the European Agenda on Migration, the Hotspot approach, the Council Decisions on Relocation.LinksEASO Operating Plan to Italy (2017) ENEASO’s Special Support Plan to Italy (2015): ENEASO Operating Plan to Italy (2013-2014), its first EN and second amendment ENAny further information on EASO may be obtained by contacting Mr. Jean-Pierre Schembri on the following e-mail address: jean-pierre.schembri@easo.europa.eu  (follow us live on Facebook and twitter @EASO).  	https://easo.europa.eu/news-events/easo-further-enhance-its-operational-support-italy-2017
EASO_NEWS_0098	2016-12-02	NEWS	Wolfgang Sobotka, Austrian Federal Minister of Interior, visited EASO Headquarters in Malta, Valletta	 PR 25/20162 December 2016Valletta, MaltaOn 2 December, José Carreira, Executive Director of EASO, welcomed the Austrian Federal Minister of Interior, Wolfgang Sobotka, and his team to EASO headquarters in Valletta, Malta. During the meeting, EASO presented the most important aspects related to the activities and policies it implements as an important actor of European Solidarity, fostering greater cooperation with and between Member States. Important topics were discussed on bilateral level, such as the latest asylum trends, EASO’s operational activities in Greece and Italy, status and recent dynamics of the EU Relocation Programme, Member State experts needed on the ground, as well as further development, envisaged for EASO in 2017.EASO’s Executive Director, José Carreira thanked the Austrian Minister for his visit and for the valuable work which Austrian experts have been conducted while deployed for EASO in Italy and Greece.Minister Sobotka commended the excellent work which EASO has been conducting in the field and the fact that it has been working relentlessly to overcome the various challenges and to do its part in the implementation of the EU-TR Statement.During his visit, Minister Sobotka was accompanied by Mag Wolfgang Taucher, Director of the Federal Asylum Agency and Chairman of the EASO Management Board.Any further information on EASO may be obtained by contacting Mr. Jean-Pierre Schembri on the following e-mail address: jean-pierre.schembri@easo.europa.eu  (follow us live on twitter @EASO). Download Press Release [EN]  	https://easo.europa.eu/news-events/wolfgang-sobotka-austrian-federal-minister-interior-visited-easo-headquarters-malta
EASO_NEWS_0099	2016-11-28	NEWS	PRESS RELEASE - EASO Consultative Forum 2016	 Press Release: EASO Consultative Forum in Athens attracts over 200 members of Civil Society Organisations and individuals On 28-29 November 2016, the European Asylum Support Office (EASO) holds its sixth Consultative Forum plenary meeting. The aim of the event, which is organised annually, is to discuss ideas and experience from Civil Society, relevant to EASO’s work, in particular, the hotspots. For the first time, this meeting is held in Athens, Greece, in order to facilitate the participation of actors operating in the field of asylum and reception in Greece. New is also the adoption of a fully participatory format, which aims to result in an authentic dialogue, and offer the participants the opportunity to proactively engage, contribute to the agenda setting, and share ideas. The meeting was opened by the European Commissioner for Migration, Home Affairs and Citizenship, Dimitris Avramopoulos. Some of Europe’s most notable and active actors in the field of asylum will address the forum, including EASO Executive Director Jose Carreira, UNHCR Director of the Bureau for Europe Vincent Cochetel, the Director of the Greek Asylum Service Maria Stavropoulou, and ECRE Secretary General Catherine Wollard. Download Press Release [EN] [EL] 	https://easo.europa.eu/news-events/press-release-easo-consultative-forum-2016
EASO_NEWS_0100	2016-12-16	NEWS	EASO publishes a Country of Origin Information (COI) report on national service and illegal exit in Eritrea.	 Today, the European Asylum Support Office (EASO) published a Country of Origin Information (COI) Report entitled ‘Eritrea – National service and illegal exit’. The report is an update of the 2015 EASO COI Report Eritrea Country Focus (1)It provides an overview on aspects related to national service and illegal exit in Eritrea relevant to international protection status determination of Eritrean applicants. In the first ten months of 2016, Eritrea ranked 7th  in the top countries of origin in EU+ countries (2) with a total of 31 416 applicants.The EASO COI report at hand updates and further expands the sections of the 2015 EASO COI Report Eritrea Country Focus that related to national service and illegal exit. It is therefore not to be considered as a general overview of the human rights situation in Eritrea, nor as a comprehensive presentation of national service in Eritrea. The main aim of the report is to present the latest findings on the aforementioned topics based on a variety of sources. As the availability of reliable and up to date information on Eritrea is known to be problematic, information from the various categories of sources from within and outside Eritrea (Eritrean government, international observers, reports by third parties) is set out in separate sub-chapters in relation to each topic, in order to ensure full transparency.Draft evasion, desertion and illegal exit represent major asylum motives for Eritrean applicants for international protection. The report provides a description of the legal context and practices of national service (covering both the military and civilian branch), including the treatment by the Eritrean authorities of draft evaders and deserters. The report also looks into the legal position and treatment in practice of Eritreans who return to their country after having left it illegally, without an exit visa. New information is available regarding the duration of compulsory service and the salary paid while performing national service. In recent years, the Eritrean government has announced comprehensive reforms in these two areas and some changes can be noted, as presented in the last chapter of the report.As regards the information in those chapters of the 2015 Eritrea Country Focus not updated in the current report, no new information is available indicating changes in the situation described in these chapters. The 2015 information on those chapters therefore remains valid.The EASO COI report was drafted by the COI unit of the Swiss State Secretariat for Migration (SEM). The report was written in accordance with the EASO COI Report Methodology and presents information until 10 August 2016, stemming from publicly available sources and interviews conducted with experts. The report was reviewed by peers from EU Member States.Any further information may be obtained from the European Asylum Support Office by contacting Mr Jean-Pierre Schembri on the following e-mail address: jean-pierre.schembri@easo.europa.euDownload Report [EN]____1 EASO, Eritrea Country Focus, May 2015 (https://coi.easo.europa.eu/administration/easo/PLib/EASO-Eritrea-CountryFocus_EN_May2015.pdf).2  EU Member States plus Norway and Switzerland 	https://easo.europa.eu/news-events/easo-publishes-country-origin-information-coi-report-national-service-and-illegal-exit
EASO_NEWS_0101	2016-11-09	NEWS	Afghanistan in Focus: EASO publishes a Country of Origin Information  report on security situation in Afghanistan	 Today, the European Asylum Support Office (EASO) published a Country of Origin Information (COI) Report entitled ‘Afghanistan security situation’. The report is a second update of the version first published in February 2015 and provides a comprehensive overview of the security situation in Afghanistan, information relevant for the protection status determination of Afghan asylum seekers. Until the end of September 2016, Afghanistan ranked 2nd in the top countries of origin in EU+ countries (1 ), with more than 153,000 applicants. In addition, the Afghan applications constitute the largest backlog of all countries of origin. By the end of September 2016, there were more than 230,000 pending asylum applications from Afghan nationals in the EU+.  This COI report represents a second update on the security situation in Afghanistan (2). The report was co-drafted by researchers from the national asylum authorities of Austria, Belgium, France, Hungary and Poland in accordance with the EASO COI Report Methodology. Researchers from Greece and Slovakia did supportive research and the report was reviewed and commented upon by COI researchers from Austria, Canada, EASO, Finland, Ireland and UNHCR.The ‘Afghanistan security situation’ report provides a general description of the security situation in Afghanistan, covering the following topics: a brief historic overview; actors in the conflict; security trends and armed confrontations, description of tactics and arms used; state ability to secure law and order; impact of the violence on the civilian population; and the geographical overview of the security situation. The report also provides a description of the security situation for each of the 34 provinces and Kabul City. In these chapters, a general overview of the province is given, followed by a background on the conflict and actors in the province, and recent security trends including data on violent incidents, and qualitative information on the type of violence. Finally, a brief overview of violence-induced displacements is given. The reference period for the security report runs from 1 September 2015 until 31 August 2016.Main findingsWhereas there continue to be important differences in the security situation in various regions of Afghanistan, in recent years, Afghanistan witnessed a broadening geographical spreading of violence.The International Military Forces’ withdrawal by the end of 2014 left a greatly reduced contingent of foreign troops (less than 10,000 in 2016, compared to more than 100,000 before 2012) to support Afghan National Security Forces (ANSF) and the government in the fight against the insurgents.Although the Islamic State (IS) has recently lost support and terrain, it still maintains its main base in a few districts of Nangarhar province and is known for its cruelty against the local population.It is EASO’s intention to continue to produce such reports on important countries of origin and to update them regularly in order to raise and harmonise COI standards in the EU and to further support the practical implementation of the Common European Asylum System.See Report [EN]Any further information may be obtained from the European Asylum Support Office by contacting Mr Jean-Pierre Schembri on the following e-mail address: jean-pierre.schembri@easo.europa.eu 1EU Member States plus Norway and Switzerland2 All reports are available via EASO’s website: (http://easo.europa.eu/asylum-documentation/easo-publication-and-documentation/). 	https://easo.europa.eu/news-events/afghanistan-focus-easo-publishes-country-origin-information-report-security-situation
