id	date	text_type	title	text	url
EASO_NEWS_0029	2020-07-29	NEWS	Almost 100 vulnerable asylum seekers relocated from Cyprus and Greece	 Over the past few days, 99 vulnerable asylum applicants have been relocated to Finland and Germany, as part of the European Union’s ongoing support to frontline Member States.The European Asylum Support Office (EASO) and the European Commission, together with the UNHCR and IOM are supporting the Cypriot and Hellenic authorities to scale up the relocation of vulnerable asylum applicants to EU+ Member States. These relocations of individuals in need of particular support are expected to continue throughout the summer months.EASO has a significant role in the ongoing relocations of minors who are determined as eligible for relocation by the national authorities. This includes carrying out the Best Interest Assessments which evaluate if such transfers are in the interest of the individuals, including that of their psychological well-being. The Agency also carries out interviews and the matching exercises which determine to which of the pledging Member States each applicant is best suited. This exercise takes into consideration factors such as cultural, family, linguistic and diaspora ties. Follow-up support is also provided to the relocating Member States when needed.The first of the two most recent relocation exercises was carried out on 24 July 2020, with the transfer of 83 individuals in families with children with serious health issues from Greece to Germany. This relocation was part of the ongoing EU scheme to relocate 1,600 minors to various European countries. The scheme, which is a tangible example of EU solidarity for Greece, provides for sick children and unaccompanied minors (UAMs) who are particularly vulnerable due to their young age and lack of family care, to start off new safe lives with strong support networks. So far, around a dozen EU+ Member States have pledged to relocate UAM’s under this scheme, with Germany also agreeing to welcome 243 children with serious health issues, together with their families. The second relocation exercise, which is not part of the EU scheme, took place on the morning of 27 July 2020, with the transfer of 16 individuals in families with single parents from Cyprus to Finland. The group consisted of families from Somalia and the Democratic Republic of Congo. EASO and the Cyprus Asylum Service also conducted a pre-departure orientation session on 22 July 2020, in order to provide the individuals with practical information on what to expect as they begin their new lives. For all relocations, special provisions have been made to account for the COVID-19 pandemic, including by testing all relocated individuals before leaving Cyprus and Greece.Recently, the Executive Director of EASO, Nina Gregori, visited both Cyprus and Greece, holding constructive meetings with Nicos Nouris, Minister of Interior of Cyprus; Notis Mitarachi, Minister of Immigration and Asylum of Greece; and Giorgos Koumoutsakos, Alternate Minister for Migration and Asylum of Greece. Both countries have been making strong efforts to modernise and expand their asylum systems and facilities.  	https://easo.europa.eu/news-events/almost-100-vulnerable-asylum-seekers-relocated-cyprus-and-greece
EASO_NEWS_0030	2020-07-14	NEWS	Asylum applications in EU remain limited in May	 Despite the slow lifting of containment measures across most EU+ countries1, asylum applications remained significantly reduced (-84%) in May compared to pre-COVID levels. At the same time, the number of cases awaiting a decision continue decreasing as national authorities redeploy staff to clear backlogs.Notwithstanding the gradual easing of containment measures across the EU+, asylum activities have still not fully resumed in many countries. Indeed, just 10 200 applications were lodged in the EU+ in May, up slightly compared to April (8 730), but still a dramatic decline from 65 692 applications in January 2020.In May, several Member States remained in a state of health emergency, with many only providing for the pre-registration of new asylum applications, but not their formal lodging. This might imply that a backlog is being formed in these countries which will need to be dealt with once full services resume.As has been reported in previous weeks, the European Asylum Support Office (EASO) expects the number of recorded applications to begin increasing as asylum services begin to return to normal operations. This may, however, continue to be limited to a certain degree in the current period as travel restrictions and closed external borders with various non-EU countries remain in place.In May, the share of repeated applications – i.e. those lodged by applicants in the same country where a previous application was already rejected or discontinued - doubled to 16%, from pre-COVID levels (8%). Similarly, a slightly higher proportion of Unaccompanied Minors applied for asylum (up by more than 1 percentage point to over 4% of all applications), since in many countries’ vulnerable applicants were given priority for lodging applications.  Syrians, Afghans and Iraqis continued to lodge the most applications, accounting for a third of all applications lodged in May. The composition of other top countries of origin is more influenced by differential resumption of activities in national asylum authorities, rather than indicative of asylum-related migration trends to the EU+. For example, Venezuelans and Colombians – who were among the top four nationalities of applicants at the beginning of this year (January – March) – lodged only 131 and 87 applications, respectively.At least 27 300 decisions were issued by asylum authorities (first instance) in May, down by 42% from February2. Thus, decision-making continued to be less affected by containment measures compared to the lodging of applications, which shows that asylum authorities continued to process cases despite the temporary suspension of some services.As a result of more decisions being issued than applications lodged, at the end of May the number of pending cases at first instance decreased to some 462 829, down by more than 32 300 cases from February (-7%).For more information and an interactive data-visualisation, please visit the Latest Asylum Trends page.Any further information may be obtained from the European Asylum Support Office on the following email address: press@easo.europa.eu.Photo: © iStock/Theerakit1Includes European Union Member States, Iceland, Lichtenstein, Norway and Switzerland.2Data on first-instance decisions were missing for one count. 	https://easo.europa.eu/news-events/asylum-applications-eu-remain-limited-may
EASO_NEWS_0031	2019-10-15	NEWS	EASO continues to make improvements in its governance	 Corrective measures are being implemented to address findings.EASO takes the findings of the European Court of Auditors (ECA) seriously and continues to ensure that improvements are implemented swiftly. EASO also welcomes the acknowledgment by ECA of the concrete and positive steps taken to improve the Agency’s governance, which was recognised by the European Parliament in September 2019. A Governance Action Plan is being implemented to restore trust in the Agency, to reinforce the internal governance framework and internal control, and to rebuild internal capacity. To date, most of the key measures foreseen in the plan have been completed (48 actions out of 61), including a long-term recruitment plan, through which the total staff count of the Agency has increased to 308 to date. The Governance Action Plan also puts emphasis on procurement and contract management. A number of measures have been implemented to guarantee full compliance with procurement rules and sound financial management. Concerning the ECA finding on the irregularity of one procurement procedure in 2018, EASO will take corrective action while ensuring business continuity. EASO is currently implementing four Operating Plans in Italy, Greece, Cyprus and Malta, in 88 locations with more than 900 field workers including EASO staff, deployed Member State experts, temporary agency workers and interpreters operating under the EASO banner. EASO foresees its continued operational presence in these countries as well as possibly scaling up based on needs assessments conducted with the authorities of each requesting Member State. Due to the insufficient numbers of national experts deployed by Member States (16%), it has been a challenge for the Agency to deliver the requested support, which required the use of alternative solutions including the services of temporary agency workers to meet the needs. The Agency, under its new management, is firmly committed to continue supporting Member States in the implementation of the Common European Asylum System, fostering practical cooperation, and providing operational and technical assistance. Any further information may be obtained from the European Asylum Support Office on the following email address: press@easo.europa.eu.Photo: © Getty Images/Serhii Brovko 	https://easo.europa.eu/news-events/easo-continues-make-improvements-its-governance
EASO_NEWS_0032	2020-02-26	NEWS	Asylum applications in the EU increase by 13% in 2019	 For the first time since 2015, applications increased from the previous year. The increase was not largely driven by irregular migration, but rather by applications from countries with visa-free access to Schengen.More than 714 000 applications were lodged in the EU+ in 2019, up by 13% from 2018, when fewer than 635 000 were registered. This is the first time since 2015 that there have been more applications than the previous year, and occurred despite reduced irregular migration towards the European Union.This initial information was released by the European Asylum Support Office (EASO) on 26 February 2020 in a public summary. Commenting on the release, EASO’s Executive Director, Nina Gregori, stated: “Today’s figures highlight that while we remain well below the situation of a few years ago, we need to continue to be vigilant and strengthen our asylum practices. A sustainable, fair and crisis-proof asylum system in the European Union is needed. To further feed into this process, on 26 June EASO will release its Annual Report, which will provide a more detailed picture of the state of the EU’s asylum system, as well as where it is heading.” The top three countries of origin of applicants were Syria (about 72 000), Afghanistan (60 000) and Venezuela (45 000). Afghans sought asylum in far larger numbers than a year earlier, as did Venezuelans, who lodged more than twice as many applications (approximately 22 000 applications in 2018).Most of the increase is accounted for by the large number of applications lodged by applicants who are exempt of visa requirements when entering the Schengen Area, which explains why applications for international protection have increased but detections of illegal entry at the external border have decreased. Such visa-free applicants were mostly from Latin America and included, beside Venezuelans, nationals of Colombia, El Salvador and Honduras.Fewer positive decisions on applications for international protectionThe EU+ recognition rate in 2019 stood at 33% meaning that about one in three decisions granted EU-regulated forms of protection. Syrian (85%), Yemeni (82%) and Eritrean (81%) nationals had the highest recognition rates, whereas the number of positive decisions for visa-free nationals was generally extremely low.Examples of the low recognition rate for visa-exempt applicants were seen among Western-Balkan citizenships, ranging from 1% for North Macedonians to 6% for Albanians. Recognition rates for Venezuelans (at 5%) and Colombians (at 7%) were also low.At the end of November 2019, there were more than 900 000 cases pending a final decision in the EU+. Most of these cases were with first-instance asylum authorities (as opposed to with the judiciary in appeal). At the end of the year, more than 540 000 applications were awaiting a first-instance decision, up by 20% from a year earlier.For more information and an interactive data-visualisation, please visit the Latest Asylum Trends page. Any further information may be obtained from the European Asylum Support Office on the following email address: press@easo.europa.eu. 	https://easo.europa.eu/news-events/asylum-applications-eu-increase-2019
EASO_NEWS_0033	2019-10-08	NEWS	Over 900 EASO personnel deployed in operations in four EU Member States	 EASO providing more operational support than ever before with 40% of Agency’s 2019 budget committed to working with our partners on the ground.The European Asylum Support Office (EASO) has reached unprecedented levels of operational activity in supporting the asylum authorities of Cyprus, Greece, Italy and Malta. At the end of September 2019, 926 personnel were operating under the EASO banner in these Member States, including EASO staff, deployed Member State experts, locally contracted personnel and interpreters. This figure varies between 900-1000 personnel on a weekly basis based on deployment rotations.Of these 926 deployments in the last week of September, 510 were present in Greece; 296 in Italy; 71 in Cyprus; and 49 in Malta. In 2019, these EASO personnel have been operational in 88 locations in the four Member States (43 in Italy; 36 in Greece; 7 in Cyprus; and 2 in Malta). EASO’s commitment to partnering at an operational level with these Member States translates into a EUR 38.4 million commitment for 2019, equivalent to almost 40% of EASO’s overall budget.All of the operations are based on annual Operating Plans signed with Malta in June 2019, and Cyprus, Greece and Italy in December 2018. These Plans govern the technical and operational support which is provided to the national authorities, including information provision, registration of applications, conducting interviews and drafting opinions, preparing files, handling outgoing Dublin take-charge requests, as well as building capacity and expertise in national asylum and reception authorities.In September, a Hosting Agreement was signed with Cyprus, providing legal clarity for EASO’s staff and assets in the country, while talks with the Greek authorities on a similar agreement are in the final stages.EASO is particularly grateful to EU+ Member States who continue to deploy national experts to the Agency’s operations, as a clear demonstration of solidarity to front-line Member States.‘Messina Model’ developed for ad hoc disembarkationsThroughout 2019, EASO has also been very active as a primary EU actor, together with the European Commission, in supporting Italy and Malta in the so-called ad hoc disembarkations and voluntary relocations following rescue operations, primarily from Non-Governmental Organisation (NGO) vessels. To date, such support has been provided following the disembarkation of 16 vessels.The Agency, together with the European Commission, has developed the so-called ‘Messina Model’ to manage such procedures in an efficient manner, while also respecting the rights of asylum applicants. Under this procedure, EASO carries out registration and pre-selection interviews, supports relocating Member States with selection missions or additional interviews, as well as coordination between Member States.EASO welcomes the ongoing discussions by Member States on providing a more structured approach to the current ad hoc system, including at today’s Justice and Home Affairs (JHA) Council meeting. While not a replacement for a predictable and permanent system, it nevertheless is a way forward to which EASO stands ready to contribute. Any further information may be obtained from the European Asylum Support Office on the following email address: press@easo.europa.eu. 	https://easo.europa.eu/news-events/over-900-easo-personnel-deployed-operations-four-eu-member-states
EASO_NEWS_0034	2019-10-10	NEWS	Pending first-instance asylum cases at highest level since December 2017	 Between January and August 2019, some 456 000 applications for asylum were lodged in the EU+, up by 10% compared to the same period last year. The updated figures are in line with the trend seen throughout the year. However, following a peak in July (62 900), 12% less applications were registered in August (55 400).The main countries of origin remained Syria, Afghanistan and Venezuela, all with fewer applicants than in July – as was also the case for the majority of the top 30 citizenships of origin. However, some nationalities applied more for asylum than in most other months in 2019, such as Syrians, Afghans and Turks. In a longer-term perspective, between January and August 2019 the majority of the 30 most common citizenships of origin lodged more applications than in 2018.At the same time, there was a marked increase in the number of first-instance decisions for Venezuelans, Salvadorians and Colombians, particularly over the summer. So far, in 2019 these three citizenships have already received as many decisions as in the whole of 2018, in particular Venezuelans (four times as many as in the whole of the past year) and El Salvador (+ 70%). Nevertheless, the overall output of EU+ first-instance authorities is still lagging behind last year’s (- 7%).At the end of August, there were still some 471 200 applications awaiting a decision in first instance in the EU+, a noteworthy increase – by some 15 000 cases – for a second consecutive month. This was the highest number of pending cases since December 2017. In addition, a similar number of applications were awaiting a decision in appeal or review at the end of June 2019, amounting to some 895 760 cases pending at all instances overall. One in five applications pending at first instance in August pertained to Syrian or Venezuelan nationals.EASO providing more operational support than ever beforeEarlier this week, the European Asylum Support Office (EASO) reported that over 900 personnel are now deployed in Greece, Italy, Cyprus and Malta to support the national authorities’ asylum services. So far, in 2019 this unprecedented operational support, which accounts for almost 40% of the Agency’s budget, has seen EASO personnel present in 88 locations in the four Member States.   For more information and an interactive data visualisation, please visit the Latest Asylum Trends page. Any further information may be obtained from the European Asylum Support Office on the following email address: press@easo.europa.eu. 	https://easo.europa.eu/news-events/pending-first-instance-asylum-cases-highest-level-december-2017
