id	date	title	text	url
ACER_NEWS_0001	2021-06-11	Building trans-European energy infrastructure: ACER finds that more than half of the projects are on time, but observes several delays and some potentially non-robust Projects of Common Interest (PCIs)	 Section 1 Body HtmlACER has published the 7thedition of its annual report on the progress of electricity and gas Projects of Common Interest (PCIs​) for trans-European energy infrastructure.​Overall, ACER notes a positive trend in their advancement: about two-thirds of the electricity and gas PCIs are already in permit granting, under construction or commissioned, while about one-third of them are less advanced, being under consideration or planned, but not yet in the permitting phase,the implementation of more than half of the PCIs progressed in a timely manner, 70% of the projects are expected to be implemented by 2025.However, ACER notes that about 25% of the electricity and gas projects cumulate delays from year to year, and several additional projects are postponed by their promoters. ACER also identified some PCIs that did not advance their status over the past six years (with most of them remaining in the permitting phase). This led ACER to conclude that project promoters' projections were too optimistic.The report also warns about potentially non-robust PCIs, which did not carry out any work or activity during the reporting period, being on hold or rescheduled by the project promoters for at least 2 years, and/or failed to move forward from an early advancement status for several years. ACER calls for additional scrutiny during the PCI selection for such projects to ensure the robustness of the 5th PCI list, so that only projects which are clearly a priority are included.​​​Robust PCIs are crucial to achieve carbon-neutral energy systems in the futureEnergy networks play a key role in the transition to carbon-neutral energy systems. As PCIs are key cross-border electricity and gas infrastructure projects that enhance the links between the energy systems across Europe, they also play a crucial role in helping the EU to achieve its energy policy and climate objectives by delivering socio-economic and environmental benefits.Access the PCI Report​ and related Annex I for project specific information on electricity PCIs and Annex II for further information on Gas PCIs.----------------------------------------------------​-------------------------------Background information​By way of background, the broader framework in Europe for cross-border energy infrastructure (the TEN-E framework) is currently under negotiation by the European Parliament and the Council.Here, ACER, together with CEER, has made several recommendations on how to improve the overall PCI framework (including the governance of infrastructure development, the scope of PCIs and the TEN-E processes) with the aim of promoting a neutral and independent technical assessment and ensuring support to those projects bringing most benefits for the European Green Deal and to avoid any risks of unjustified costs for consumers. For more information, please refer to ACER-CEER Position Papers of 5 March 2021 and 19 June 2020 as well as earlier ACER Position Papers published in 2017 and 2016.	https://extranet.acer.europa.eu/Media/News/Pages/Building-trans-European-energy-infrastructure.aspx
ACER_NEWS_0002	2021-06-07	Register for ACER Webinar on the High-level Approach to Identify Alternative Bidding Zone Configurations for a more efficient energy market	 Section 1 Body Html​The EU Agency for the Cooperation of Energy Regulators (ACER) opens registration today for an online webinar on 24 June 2021 to present the high-level approach that ACER intends to follow for the definition of alternative bidding zone configurations to be considered in the bidding zone review process, according to the EU Regulation on the Internal Market for Electricity.Register by 22 June and access the agenda.​ What are the bidding zones?Bidding zones, as the largest geographical areas within which market participants are able to exchange energy without capacity allocation, represent a cornerstone of market-based electricity trading and should therefore be defined in a manner to ensure efficient congestion management and overall market efficiency. In particular, bidding zone borders shall be based on long-term, structural congestions in the transmission network and the configuration of bidding zones shall be designed in such a way as to maximise economic efficiency and to maximise cross-zonal trading opportunities, while maintaining security of supply.What can you learn in this webinar?This webinar will present ACER's high-level approach for the definition of alternative bidding zone configurations as well as how clustering algorithms can be applied on nodal simulation results to support the identification of alternative bidding zone configurations.A public consultation on relevant aspects of this high-level approach is planned to be launched shortly after this webinar takes place. ​​	https://extranet.acer.europa.eu/Media/News/Pages/Register-for-ACER-Webinar-on-the-High-level-Approach-to-Identify-Alternative-Bidding-Zone-configurations-for-a-more-efficie.aspx
ACER_NEWS_0003	2021-06-04	ACER to decide on the long-term cross-border capacity calculation methodology for the Core region, comprised of 13 Member States	 Section 1 Body Html​​​​​​The National Regulatory Authorities of the Core region asked the EU Agency for the Cooperation of Energy Regulators (ACER) to decide on the long-term capacity calculation methodology (LT CCM) for the region.The Core region comprises 13 countries: Austria, Belgium, Czechia, Croatia, France, Germany, Hungary, Luxembourg, the Netherlands, Poland, Romania, Slovakia and Slovenia.What are the benefits?Long‐term cross-border capacity calculation promotes effective long‐term cross‐zonal trade. By calculating reliable capacities and making them available to market participants at an early stage, long-term capacity calculation allows for long‐term planning and provides hedging opportunities.The long-term capacity calculation methodology for the Core region shall cover yearly and monthly capacity calculation processes, by applying the flow-based approach.How exactly will this ACER Decision contribute to a more integrated European electricity market?ACER's Decision will contribute to the effectiveness and integration of the Core electricity markets by establishing the common rules for calculating the long-term cross-zonal capacity at regional level. ​Next steps:ACER will launch a public consultation for four weeks; expected dates are from 5 – 31 July 2021.On 9 July, ACER will organise a workshop on this topic.​ ACER expects to reach its decision by 3rd November 2021.​​	https://extranet.acer.europa.eu/Media/News/Pages/ACER-to-decide-on-the-long-term-cross-border-capacity-calculation-methodology-for-the-Core-region,-comprised-of-13-Member-S.aspx
ACER_NEWS_0004	2021-06-02	ACER releases its second 70% target report on the minimum margin available for cross-zonal electricity trade in the EU	" Section 1 Body Html​Europe's Clean Energy Package (CEP) has set a binding minimum 70% target for electricity interconnector capacity for cross-zonal trading (the 'minimum 70% target'), to be met by all Transmission System Operators (TSOs).The minimum 70% target is legally binding since the start of 2020, but Member States may also adopt transitory measures, such as action plans or derogations, thus allowing TSOs to reach gradually the minimum 70% target, by the end of 2025 at the latest.Why is monitoring the 'minimum 70% target' im​portant?The lack of sufficient cross-zonal capacity in between Member States ​is one of the main barriers to the integration of electricity markets, and market integration is key to deliver on Europe's energy goals. Larger amounts of cross-zonal capacity made available for trade increase cross-border competition and enhance the integration of renewable energy sources.ACER's monitoring aims to identify consistently across the EU the scope for improvement to meet the minimum 70% target. How are Member States doing? Efforts needed in all countries to reach the 70% targetACER's second “70% Target Report"" provides an overview of the levels of margins for cross-zonal capacity compared to the minimum legally binding 70% target for the second half of 2020, and on action plans and derogations. It also highlights the changes compared to the first report (which related to the first half of 2020).Ma​​in findings of the report:Member States have much more to do to get closer to the legally binding minimum 70% target.The levels of margins for cross-zonal capacity is mixed across the EU and are broadly similar to the levels observed in the first ​half of 2020.Member States should work to meet the 70% minimum target at all times, and to reach their target national transitional targets to gradually reach the 70% minimum.How? Members States can count on several measures at their disposal to improve the level of margin offered such as cost-efficient investments; use of remedial actions; and bidding zone reconfiguration, to help them to reach the target.The levels of cro​ss-zonal capacity are very diverse depending on the type of border and geographical location:- On high-voltage Direct Current (DC) borders, the 70% target was met most of the time but with a few notable exceptions.- On Alternating Current (AC) borders, there is a very diverse picture with significant room for improvement to meet the 70% target for most regions and borders.ACER's monitoring depends critically on TSOs providing robust and extensive data. ACER acknowledges the efforts made by a majority of TSOs to improve the provision of data. However, the completeness and quality of this data needs to be urgently improved in some regions.Regarding action plans and derogations, ACER finds significant room for further harmonising their setup across the EU. Regulatory authorities should grant derogations as a last resort measure, and only where necessary for maintaining operational security.For consistency, national regulatory authorities (NRAs) should consider the results of ACER's analysis to assess the compliance of TSOs with the minimum 70% target.​Access to the ACER's comprehensive Report and detailed Annexes​"	https://extranet.acer.europa.eu/Media/News/Pages/ACER-releases-its-second-70-target-report-on-the-minimum-margin-available-for-cross-zonal-electricity-trade-in-the-EU.aspx
ACER_NEWS_0005	2021-05-28	Gas contractual congestion decreases by 50% in the EU	 Section 1 Body Html​​The EU Agency for the Cooperation of Energy Regulators (ACER) found a halving of gas contractual congestion in the EU transmission networks according to its 8th specialised report on the subject published today. Contractual congestion may signal a reduction of market efficiency. It happens when some network users were not able to obtain the capacity product of their choice and had to rely on congestion-mitigating measures (CMPs) to access the gas market.8th Congestion Report in the EU Gas Markets and How it is Managed​Technical Annex to the Report ​Has COVID-19 effected gas capacity auctions? In 2020, the occurrences of auction premia, which arise when requests for capacity exceed the offer, dropped by 70% compared to 2019. COVID-related uncertainty as well as general demand and supply dynamics may affect whether auction premia will return in 2021 or remain scarce at around 0.6% of all auctions in scope of the analysis. How much congestion? In 2020, congestion has halved compared to previous years with 19 Interconnection Point (IP) exit and entry sides in 2020 compared to 37 exits and entries in 2019).  Half of the congestion is due to auction premia, which occurred in the auctions of yearly and quarterly capacity products. The other half is due to the lack of offer of any capacity products with a duration of one month or longer.Has any progress been registered? While the number of congested IP sides is low, local contractual congestion can be severe and reduce market efficiency. Around 85% of the congested IP sides in 2020 were also congested in the past. What comes next? Transmission System Operators ('TSOs') can apply a number of CMPs to ensure network users can access the network even when they could not obtain some capacity products in the primary capacity auctions. The Oversubscription mechanism remains the most applied CMP despite its decreased use in 2020; that decrease is partly compensated by an increased use of Firm Day-Ahead Use-It-Or-Lose-It and Surrender as CMP measures.More than 60% of the congested IP sides are already covered by the FDA UIOLI mechanism, while for the other half the respective National Regulatory Authorities (NRAs) need to take action in line with the European Commission's rules on congestion. Main recommendations ACER recommends the European Commission to revise the CMP Guidelines to enhance the effectiveness of the measures. ACER recommends ENTSOG and TSOs to continue improving data reliability to ensure the accuracy of information available at the ENTSOG Transparency Platform. ACER's call on researchersThe Congestion Report has a narrow scope of analysis, while a substantial amount of congestion data is available for deeper and broader analysis. The report has suggestions for further research and ACER calls on researchers to use the substantial amount of available data to study different aspects of congestion in EU gas markets.	https://extranet.acer.europa.eu/Media/News/Pages/Gas-contractual-congestion-decreases-by-50-in-the-EU--.aspx
ACER_NEWS_0006	2021-05-26	ACER published a Decision requesting information to monitor the level of margin available for cross-border electricity trade in the Nordics	" Section 1 Body Html​The EU Agency for the Cooperation of Energy Regulators (ACER) published today a Decision requesting the three Nordic transmission system operators Svenska kraftnät (Sweden), Energinet Elsystemansvar A/S (Denmark) and Fingrid Oyj (Finland) to provide specific information related to those network elements that are limiting the capacity calculation, the so-called critical network elements with contingencies (“CNECs"").This information is needed by ACER to monitor the level of margin available for cross-border trade on CNECs and to compare it with the 70% minimum target defined by the Electricity Regulation.Access the ACER Decision 03/2021 and related Annexes.​"	https://extranet.acer.europa.eu/Media/News/Pages/ACER-published-a-Decision-requesting-information-to-monitor-the-level-of-margin-available-for-cross-border-electricity-trad.aspx
ACER_NEWS_0007	2021-05-18	Registration open for ACER webinar on its proposal for a Framework Guideline to establish a Network Code on Cybersecurity (27 May 2021)	 Section 1 Body Html​ACER organises this online webinar to present and explain the content of its proposed non-binding Framework Guideline on sector-specific rules for cybersecurity asp​ects of cross-border electricity flows.The event will take place on Thursday 27 May 2021, from 09.30 to 12.00.Register by Tuesday 25 May and access the agenda.​ The importance of cybersecurity is increasing, given the growing technological​ development and a more digitally driven and interconnected energy system. The modern energy system is not limited by national borders. As a result, cyberattacks may have cross border effects. The non-binding Framework Guideline is developed by ACER on request of the EU Commission. It shall set out clear and objective principles for the development of a binding Cybersecurity Network Code that will contribute to maintain the security of the electricity system across Europe. The ongoing public consultation is open until 29 June 2021.ACER is inviting stakeholders to join the webinar to learn more about the content of its ​proposal​, as well as about the process and timeline for the adoption of the new Network Code.If necessary, participation may be restricted to one person per organisation.​	https://extranet.acer.europa.eu/Media/News/Pages/Registration-open-for-ACER-webinar-on-its-proposal-for-a-Framework-Guideline-to-establish-a-Network-Code-on-Cybersecurity.aspx
ACER_NEWS_0008	2021-05-18	ACER and ENTSOG publish a new solution to issue raised on Gas Network Codes Functionality platform	" Section 1 Body Html​​ACER and ENTSOG have published a solution on the Gas Network Codes Functionality (FUNC) platform, related to the issue ""Dutch TSO requirement of message PRODOC"".​The platform allows relevant parties to notify implementation and operational issues related to the gas Network Codes.​ The web-based platform collects the issues and facilitate cooperation among stakeholders to find relevant solutions.In February 2020, the European Association for the Streamlining of Energy Exchange – gas (EASEE-gas)​ reported that the Dutch TSO requirement of message PRODOC is unnecessary and contrary to Network Code on Gas Balancing of Transmission. PRODOC is a document containing information about the load forecast that a balancing responsible party sends to the system operator as part of the daily balance area management process for the day ahead.When processing the issue, ACER and ENTSOG were made aware that the use of the PRODOC message is a requirement under Dutch national law. In the issue solution, ACER and ENTSOG conclude that the review of the Dutch Energy Act is pending, and it foresees to discontinue the PRODOC requirement in the future. Since the changes in the national law remain a precondition to solve this issue and since the preparatory work for the legislative changes are ready, ACER and ENTSOG propose that the issue be solved at the national level.The solution paper and relevant documents are available on the FUNC platform. ​​"	https://extranet.acer.europa.eu/Media/News/Pages/Gas-Network-Codes-Functionality-platform-ACER-and-ENTSOG-publish-a-new-solution-.aspx
ACER_NEWS_0009	2021-05-12	Consultation launched on Gas Interconnection Points between the EU and the Energy Community and within the Energy Community	 Section 1 Body Html​The EU Agency for the Cooperation of Energy Regulators (ACER) and the Energy Community Secretariat (ECS) launched today a joint public consultation regarding gas capacity on a number of interconnection points (IPs) on the borders of the EU and the Energy Community and within the Energy Community.The consultation focuses on capacity offering and use and aims at reaching a better understanding of market needs, approaches to avoiding network interruptions, and optimising capacity availability at gas interconnectors between the EU and the Energy Community and within the Energy Community. The results of the consultation will benefit market integration, competition and ultimately gas consumers.ACER and the Energy Community Secretariat are particularly interested in hearing from users (actual and potential) of gas transport capacity and other services provided by transmission system operators (TSO) on the gas pipelines concerned.By way of this consultation, both organisations seek to gain a firmer understanding of stakeholders' views on best practices in pursuit of enhancing connectivity, optimal use of existing capacity, market integration, and competition at the concerned IPs. ACER and ECS consult the market to better understand market needs and to learn about possible approaches to avoid network interruptions and to optimise in general terms the capacity availability at EU/ Energy Community IPs.The questionnaire is framed to allow respondents to share their views on approaches ensuring the optimal use of capacity and secure and reliable flow of gas, whilst allowing for proper cooperation with regard to improving gas network services at the relevant IPs. Input from the consultation will be used by ACER and ECS to derive and share possible best practices in view of achieving better functioning markets, efficient use of infrastructure and improved security of supply. Replies to the consultation can be submitted by 30 June 2021 23:59 hrs (CET).To learn more and submit your views, visit the P​ublic Consultation webpage​​.ACER and the ECS will analyse the responses received will publish a summary of the consultation, including an evaluation of the responses. ​	https://extranet.acer.europa.eu/Media/News/Pages/Consultation-launched-on-Gas-Interconnection-Points-between-the-EU-and-the-Energy-Community-and-within-the-Energy-Community.aspx
ACER_NEWS_0010	2021-05-10	Deadline extended: call for expressions of interest to join the ACER Board of Appeal	 Section 1 Body Html​​​​​​​​​​​The European Commission has extended the deadline for expressions of interest for persons interested in becoming a member or alternate of the Board of Appeal ​of the EU Agency for the Cooperation of Energy Regulators (ACER).​The term of the current members and alternates will end on 18 October 2021. ACER's Board of Appeal's new members and alternates will be selected and proposed by the European Commission.The deadline for applications has been extended until the 25th May 2021​.For more information, see the extended deadline for the call for expressions of interest on the European Commission's website.​For more on the ACER Board of Appeal.	https://extranet.acer.europa.eu/Media/News/Pages/Call-for-expressions-of-interest-to-join-the-ACER-Board-of-Appeals-.aspx
ACER_NEWS_0011	2021-05-10	ACER has reached a Decision on the definition of capacity calculation regions	 Section 1 Body Html​The European Union Agency for the Cooperation of Energy Regulators (ACER) has reached a Decision on all Transmission System Operators (TSOs)' proposal defining the Capacity Calculation Regions (CCR).​This definition includes all the​ European Union's bidding zone borders and groups them into the different capacity calculation regions. This is relevant for the functioning of the internal energy market, as it simplifies processes by forming such sub-groups (i.e. CCRs).The determination of CCRs should combine the bidding zone borders for which the need of coordination is the highest (e.g. taking into account the interdependencies between their cross-zonal capacities) and consider where it is most efficient to apply cross regional coordination. Different regional methodologies (such as capacity calculation, re-dispatching and countertrading) will be applied on the various capacity calculation regions. This will promote an effective coordination between bidding zone borders, which enables an optimal use of transmission infrastructure across Europe, with consequential benefits for consumers. This Decision reflects the latest status of the internal energy market, including new or evolved bidding zone borders, additional TSOs and considering UK's withdrawal from the European Union.​Access the ACER Decision 04-2021 and relative Annexes​.​	https://extranet.acer.europa.eu/Media/News/Pages/ACER-has-reached-a-Decision-on-the-definition-of-capacity-calculation-regions.aspx
