id	date	title	text	url
ACER_NEWS_0092	2020-05-20	ACER reports on congestion in EU gas markets and how it is managed	" Section 1 Body HtmlThe European Union Agency for the Cooperation of Energy Regulators (ACER) publishes today the 7th edition of its Report on “contractual congestion in EU gas markets and how it is managed"". Contractual congestion may signal a reduction of market efficiency. It happens when some network users were not able to obtain the capacity product of their choice and had to rely on congestion-mitigating measures to access the gas market. 7th Congestion Report Technical Annex to the 7th Congestion Report ​​The report's main findings​How much congestion? ​In 2019, congestion has increased compared to previous years (37 IP sides in 2019 compared to 31 IP sides in 2018). Most congestion is due to auction premia, which primarily occurred in the auctions of quarterly capacity products.Has any progress been registered? While the number of congested IP sides remains relatively low, local contractual congestion can be severe and reduce market efficiency. About 40% of congested IP sides in 2019 have been found congested before. Much less capacity was made available via secondary capacity trading and or as interruptible capacity at congested IP sides than the amount of capacity that has been unsuccessfully requested by network users in primary auctions of firm capacity products. What comes next? Transmission System Operators ('TSOs') can apply a number of congestion management procedures ('CMPs') to ensure network users can access the network even when they could not obtain some capacity products in the primary capacity auctions. The Oversubscription mechanism remains the most applied CMP, whereas capacities made available via FDA UIOLI and Surrender mechanisms dropped significantly.About half of the congested IP sides are already covered by the FDA UIOLI mechanism, while for the other half the respective National Regulatory Authorities (NRAs) need to take action in line with the European Commission's rules on congestion. ACER's main recommendations to the European Commission and to ENTSOG/TSOsThe EC may revise the CMP Guidelines to enhance the effectiveness of the measures. ENTSOG and TSOs should continue improving data reliability to ensure the accuracy of information available at the ENTSOG Transparency Platform. ACER's call on researchers​​The Congestion Report has a narrow scope of analysis, while a substantial amount of congestion data is available for deeper and broader analysis. The Agency shares suggestions for further research and calls on researchers to use the substantial amount of available data to study different aspects of congestion in EU gas markets.ACER offers paid traineeship combining the onsite work experience and the possibility of contributing to the research on congestion, together with our ACER experts. Find out more about the ACER Traineeship program. "	https://extranet.acer.europa.eu/Media/News/Pages/ACER-reports-on-congestion-in-EU-gas-markets-and-how-it-is-managed.aspx
ACER_NEWS_0093	2020-05-19	EU gas supply sourcing costs fall in 2019 as prices are pressured by record LNG deliveries	 Section 1 Body Html​According to ACER's preliminary assessment, gas supply sourcing costs in most EU Member States (MSs) fell by more than 3 euros/MWh in 2019 compared with 2018. The assessment considers prices of hub traded products, declared imports and domestically produced gas.Record deliveries of liquefied natural gas (LNG) driven by international gas market dynamics, robust pipeline imports from Russia and Norway, and gas storages that had already been well stocked at the beginning of the injection season were some of the major contributing factors to EU hub's spot prices dropping to ten years' lows in 2019. This translated into much lower sourcing costs, even in MSs that do not directly import LNG, as gas flows were directed from low to high price markets. The process has been facilitated by the market design put in place by the third energy package and further refined by gas network codes. Convergence in sourcing cost remained robust in 2019 among the majority of MSs. However, as gas prices did not fall simultaneously and to the same extent across all countries, there were some gas markets where the gap between their and the benchmark sourcing costs based on Title Transfer Facility (TTF) prices grew bigger than in recent years. This gap was largest for less integrated and diversified markets, where reliance on long-term contracts (LTCs) has remained high (prices of oil-indexed LTCs and hub prices tend to diverge in periods of hub price volatility, as the former do not necessarily respond to gas market developments).Source: ACER calculation based on Eurostat Comext, ICIS Heren and NRAs. See MMR 2015, Annex 6 for details on the general methodology and specific data used for selected MSs. Generally, the combination of marginal supply and market opportunity pricing explains the enduring sourcing cost differences between some MSs. Both are in turn affected by factors like competition, transportation costs, predominant sourcing mechanisms and market structure. Price differences may also appear between the various sourcing mechanisms within a country. These aspects will be further examined in the next edition of the Gas Wholesale volume ​o​​f the Market Monitoring Report​, which will be published in September. The report will also contain the exact price estimates per MS and gas supply sourcing mechanism. Overall, in 2019 selected Central-East, South-South-East and Mediterranean MSs showed the highest prices, while most liquid Continental hubs, chiefly those more exposed to LNG, exhibited the cheapest ones.In 2020, sourcing costs are likely to again fall, with the economic slowdown caused by the Coronavirus health crises depressing energy demand and prices. 	https://extranet.acer.europa.eu/Media/News/Pages/EU-gas-supply-sourcing-costs-fall-in-2019-as-prices-are-pressured-by-record-LNG-deliveries.aspx
ACER_NEWS_0094	2020-05-12	ACER publishes its new analysis on Tariff Network Code implementation for gas in Spain	 Section 1 Body Html​The European Union Agency for the Cooperation of Energy Regulators (ACER) has published its new Report on the implementation of the Network Code on Harmonised Transmission Tariff Structures for Gas, which presents the additional analysis of the Agency for the transmission system of Spain.The Report analyses the new final consultation document published by the Spanish National Regulatory Authority (NRA), Comisión Nacional de los Mercados y la Competencia - CNMC; investigating what changed compared with the first consultation held in September 2019. The report takes also into account how ACER's previous considerations were addressed and concludes with various recommendations for the NRA's final decision. Find out more here.	https://extranet.acer.europa.eu/Media/News/Pages/ACER-publishes-its-new-analysis-on-Tariff-Network-Code-implementation-for-gas-in-Spain.aspx
ACER_NEWS_0095	2020-05-12	ACER provides its first Opinion on a bidirectional gas capacity Decision	" Section 1 Body Html​The European Union Agency for the Cooperation of Energy Regulators (ACER) publishes today its Opinion​ on the elements of the Decision to grant an exemption from the obligation to enable permanent physical bi-directional capacity at the ""Deutschneudorf EUGAL ""cross-border interconnection point (IP), between Germany and the Czech Republic. The Decision was taken by Bundesnetzagentur, Germany's National Regulatory Authority and grants the exemption for a period of four years.ACER assessed the elements of the Decision in view of the SoS Regulation and concluded that the Decision generally follows the requirements. ACER found the infrastructure standard indicators foreseen in the SoS Regulation to be already at adequate levels in Germany, in the Czech Republic and in Poland. ACER also notes the existence of available, but unexploited, permanent bi-directional capacity from the Czech Republic to Germany at the nearby Brandov virtual IP. Adding capacity from the Czech Republic to Germany in the short- to medium-term may result in considerable investment costs, which are likely to outweigh the prospective benefits for security of gas supply. ACER further notes that the request for the exemption does not include some key elements for taking a well-informed Decision: such as feasibility study, cost-benefit analysis carried out pursuant to the relevant methodology (foreseen by Regulation (EU) 347/2013), and a meaningful consultation process by the transmission system operators. The Decision could have also included options for monitoring the adequacy level of gas security of supply standards in the longer term, after two years. ACER builds its Opinion on a technical analysis of the available SoS indicators and capacities provided by the Joint Research Centre (JRC) of the European Commission (EC). ACER's Opinion is submitted to the EC for possible further action, and to all competent authorities and national regulatory authorities concerned. Access the Opinion at this link​."	https://extranet.acer.europa.eu/Media/News/Pages/ACER-provides-its-first-Opinion-on-a-bidirectional-gas-capacity-Decision.aspx
ACER_NEWS_0096	2020-05-08	ACER assesses the draft guideline for cost benefit analysis of electricity grid development projects	 Section 1 Body Html​The Agency published today an Op​inion on the 3rd draft guideline for cost benefit analysis (CBA guideline) of grid development projects, including Projects of Common Interest for trans-European energy infrastructure. The guideline appertains to the proposed methodology by the European Network of Transmission System Operators for Electricity (ENTSO-E), which will be applied to the preparation of the Union-wide ten-year network development plan and is updated and improved regularly.In addition to allowing the consistent assessment of transmission and storage projects, including potential Projects of Common Interest in the European Union, the CBA guideline is also used to develop Cross Border Cost Allocation decisions of national regulators, and by Transmission System Operators when developing their national project assessment methodologies.The Agency’s Opinion notes improvements including more transparency, clarity and better analysis of some benefits. However, important shortcomings are identified, such as the need for better alignment with the gas CBA methodology, the need to provide benefit calculations for more study years, the lack of concrete criteria for the construction of the Reference Network, the subjectivity of the assessment of benefits when based on promoters analysis, and the lack of concrete methodologies for the assessment of some benefits.   The Agency urges ENTSO-E to adapt the draft CBA Guideline so it is in line with the considerations included in the ACER Opinion before submitting it to the European Commission for approval. ​​Access the Opinion her​e​.  	https://extranet.acer.europa.eu/Media/News/Pages/ACER-assesses-the-draft-guideline-for-cost-benefit-analysis-of-electricity-grid-development-projects.aspx
ACER_NEWS_0097	2020-05-06	ACER consults on methodologies for assessing electricity resource adequacy	 Section 1 Body Html​The European Union (EU) Agency for the Cooperation of Energy Regulators (ACER) has launched today a public consultation to decide on the methodologies for assessing whether the EU, as a whole, has sufficient electricity resources to meet its future electricity needs. These methodologies, mandated by the Clean Energy Package legislation, are key in ensuring and improving the reliability of Europe's electricity supply.The methodologies, developed by the European Network of Transmission System Operators for Electricity (ENTSO-E) and submitted to ACER for approval, are:​Methodology for the European resource adequacy assessment (ERAA) to be conducted every year by ENTSO-E based on the data provided by national transmission system operators. This will allow assessing the overall adequacy of the electricity system to supply current and projected demands for electricity at Union level, at the level of Member States and at the level of individual bidding zones.Methodology for calculating the value of lost load, the cost of new entry and the reliability standard (VoLL, CoNE, RS) to provide the Member States with a common approach for determining their desired levels of security of electricity supply. ACER is competent to decide on these proposals in accordance with its founding Regulation and the recast Electricity Regulation, amending them where necessary.In order to inform our decisions, we are seeking views from all the interested parties during a three-week public consultation, until 27 May 2020.Find out more about the consul​tation​.​ACER's Public Notice informing about the initiation of this procedure can be found h​ere.​​	https://extranet.acer.europa.eu/Media/News/Pages/ACER-consults-on-methodologies-for-assessing-electricity-resource-adequacy.aspx
ACER_NEWS_0098	2020-04-30	ACER launches consultation to integrate further electricity balancing between Denmark, Finland, Sweden and Norway	 Section 1 Body Html​The European Union Agency for the Cooperation of Energy Regulators (ACER) launches today a public consultation in accordance with the EU Regulation establishing a Guideline on Electricity Balancing, which aims to further integrate the EU balancing markets regionally. It refers to the methodologies needed to create a common Nordic automatic Frequency Restoration Reserve (aFRR) Balancing Capacity Market for Denmark, Finland, Sweden and Norway.The methodologies provide the description of common and harmonised rules for the procurement of balancing capacity, as well as the method to determine the value and amount of cross-zonal capacity allowing the exchange of balancing capacity between those countries.​ All interested parties are invited to submit their comments by 20 May 2020, 23:59 hrs (CET)​.  Find out more about the consult​ation.​	https://extranet.acer.europa.eu/Media/News/Pages/ACER-launches-consultation-to-integrate-further-electricity-balancing-between-Denmark,-Finland,-Sweden-and-Norway.aspx
ACER_NEWS_0099	2020-04-28	ACER to decide on cost sharing methodology ensuring firmness and remuneration of long-term transmission rights	 Section 1 Body Html​The European Union Agency for the Cooperation of Energy Regulators (ACER) will decide the methodology for sharing costs incurred to ensure firmness and remuneration of long-term transmission rights for electricity.This methodology will set out the rules for sharing costs among transmission system operators incurred by ensuring firmness and remunerating the long-term transmission rights holders after the publication of the single day-ahead coupling results with optimised capacity allocation.ACER must reach a decision before 23 October 2020.	https://extranet.acer.europa.eu/Media/News/Pages/ACER-to-decide-on-cost-sharing-methodology-ensuring-firmness-and-remuneration-of-long-term-transmission-rights.aspx
ACER_NEWS_0100	2020-04-24	ACER publishes its analysis on Tariff Network Code implementation for gas in Great Britain	 Section 1 Body HtmlThe EU Agency for the Cooperation of Energy Regulators (ACER) has published its 27th report on the implementation of the Network Code on Harmonised Transmission Tariff Structures for Gas, which presents the analysis of the Agency for the transmission system of Great Britain.The Report analyses the consultation document published by Office of Gas and Electricity Markets (Ofgem), the National Regulatory Authority (NRA) for Great Britain. The Agency has various recommendations for the final decision of the NRA. Find out mo​re.​	https://extranet.acer.europa.eu/Media/News/Pages/ACER-publishes-its-analysis-on-Tariff-Network-Code-implementation-for-gas-in-Great-Britain.aspx
ACER_NEWS_0001	2020-03-15	Pulling together while maintaining social distance: ACER staff to work remotely from Monday 16 March 2020	 ​The Agency has requested all ACER staff to telework from Monday 16 March 2020 until (provisionally) Friday 27 March 2020, with the exception of some critical functions necessary for business continuity.We do this as a precautionary measure, protecting our staff whilst continuing our operations, in line with the latest measures introduced by our host country, Slovenia, to contain the proliferation of the Corona virus.As a result, all meetings with external participants scheduled to take place at our premises will be postponed/cancelled or organised via video conference. This measure notwithstanding, our overall aim is to keep operations going to the maximum extent, seeking to minimize disruptions or delays vis-à-vis our partners and stakeholders. 	https://www.acer.europa.eu/Media/News/Pages/Pulling-together-while-maintaining-social-distance-ACER-staff-to-work-remotely-from-Monday-16-March-2020.aspx
ACER_NEWS_0002	2020-03-09	Fostering a single EU balancing market for electricity:  ACER launches two new consultations	 ​The European Union Agency for the Cooperation of Energy Regulators (ACER) launches today two public consultations in line with the EU Regulation establishing a Guideline on Electricity Balancing, which aims to integrate the EU balancing markets.All interested parties are invited to submit their comments by 29 March 2020. The first consultation refers to the methodology for classifying the activation purposes of balancing energy bids. The methodology provides the description and rules for all possible activation purposes, ​providing the same level of transparency when activating balancing energy bids across Europe.​ Access the consultation.The second consultation is on further specifying and harmonising the imbalance settlement, which should ensure that the balance responsible parties support the system's balance in an efficient way. Access the consultati​on.	https://www.acer.europa.eu/Media/News/Pages/Fostering-a-single-EU-balancing-market-for-electricity--ACER-launches-two-new-consultations.aspx
ACER_NEWS_0003	2020-03-06	Delivering on the Clean Energy Package: ACER decides on common rules for electricity risk preparedness	 ​The European Union Agency for the Cooperation of Energy Regulators (ACER) published today two Decisions on the methodology for identifying regional electricity crisis scenarios and on the methodology for short-term and seasonal adequacy assessments.  Both are part of the implementation of the EU Risk-preparedness Regulation, part of the Clean Energy for all Europeans Package.The EU Risk-preparedness Regulation introduced a set of rules on how to prevent, prepare for and manage electricity crises, bringing more transparency in the preparation phase and during an electricity crisis and ensuring that measures are taken in a coordinated and effective manner. The Regulation is intended to contribute to the implementation of the objectives of the Energy Union, of which energy security, solidarity, trust and an ambitious climate policy are an integral part.The methodology for identifying regional electricity crisis scenarios sets a common approach in identifying risk scenarios at regional level. Both regional electricity scenarios, prepared by European Network of Transmission System Operators for Electricity (ENTSO-E), and national electricity scenarios, prepared by national competent authorities, will serve as a basis for the establishment of consistent risk-preparedness plans by the national competent authorities.The methodology for short-term and seasonal adequacy assessments sets a common approach for the assessment of possible adequacy related concerns that may occur from six months ahead to day-ahead: such common methodological framework will be used for assessments performed at Union, regional and national level.Documents:You can access both ACER Decisions (N. 07 and N. 08) and relative Annexes here.EU Risk-preparedness RegulationClean energy for all Europeans package	https://www.acer.europa.eu/Media/News/Pages/Delivering-on-the-Clean-Energy-Package-ACER-decides-on-common-rules-for-electricity-risk-preparedness.aspx
ACER_NEWS_0004	2020-03-06	ACER publishes its analysis on Tariff Network Code implementation for gas in Austria	 ​The European Union Agency for the Cooperation of Energy Regulators (ACER) has published its 26th report on the implementation of the Network Code on Harmonised Transmission Tariff Structures for Gas, which presents the analysis of the Agency for the transmission system of Austria.The Report analyses the consultation document published by E-Control, the National Regulatory Authority (NRA) for Austria. The Agency has various recommendations for the final decision of the NRA. Find out more​ here.	https://www.acer.europa.eu/Media/News/Pages/ACER-publishes-its-analysis-on-Tariff-Network-Code-implementation-for-gas-in-Austria.aspx
ACER_NEWS_0005	2020-02-19	ACER launches workshop and two consultations fostering single EU balancing market for electricity	 ​The European Union Agency for the Cooperation of Energy Regulators (ACER) launches today two public consultations in line with the EU Regulation establishing a Guideline on Electricity Balancing, which aims to integrate the EU balancing markets.All interested parties are invited to submit their comments by 10 March 2020.  ACER will also organise a workshop on both proposals in Ljubljana on 26 February. You can register h​ere​.The first consultation is on the methodology establishing a list of standard products for balancing capacity for frequency restoration reserves and replacement reserves. The methodology provides the rules for an efficient exchange, sharing and procurement of reserves on a cross-border in Europe.            Access this consultation here.​The second consultation is on the methodology establishing a co-optimised allocation process of cross-zonal capacity for the exchange of balancing capacity or sharing of reserves, which should lay the ground for an optimised allocation of cross-zonal capacities to the day-ahead energy or balancing capacity markets to maximise possible welfare gains.            Access this consultation h​ere.Ahead of publishing the results of both consultations, ACER will organise a workshop​ on 26 February in Ljubljana. The event is organised on a first come first served basis.In this workshop, stakeholders will get insights about the Agency's proceedings related to these two proposals, the discussions between the Agency, regulatory authorities and Transmission System Operators and will be able to express their views. In order to have the widest possible contributions, participation may be restricted to one person by organisation.​	https://www.acer.europa.eu/Media/News/Pages/ACER-launches-a-workshop-and-two-consultations-fostering-a-single-EU-balancing-market-for-electricity.aspx
ACER_NEWS_0006	2020-02-18	Decarbonising the power sector: ACER provides further guidance on CO2 emission limits	" ​​Soon after the European Commission announced a roadmap for the European Green Deal, the EU Agency for the Cooperation of Energy Regulators (ACER) released its first Opinion covering the topic of carbon dioxide (CO2) emissions. The Opinion provided technical guidance on the calculation of CO2 emission limits in the framework of Capacity Mechanisms. Today, ACER complements that work with a paper providing examples of calculation for different types of production units.These examples range from non-trivial applications of supplementary firing, district heating, co-firing and multi-shaft combined cycle turbines, to the case of a coal-fired generation unit participating in a strategic reserve scheme.ACER's coordination with National Regulatory Authorities and capacity providers to implement CO2 emission limits is part of the overall increased leading role of ACER “to support the EU in achieving its climate objectives"", as underlined by ACER Director Christian Zinglersen in his introductory statement to the European Parliament.Background​In 2019 ACER received a mandate for providing technical guidance on the calculation of CO2 emission limits in the framework of Capacity Mechanisms. Following intensive consultation with interested stakeholders, ACER's Opinion - published in December 2019 - has singled out the principles for a comprehensive, harmonised approach to calculate emission limits at EU level.CO2 emission limits will contain the environmental impact of Capacity Mechanisms by allocating capacity remuneration to generation capacity with lower carbon intensity: an essential tool to move towards the achievement of EU climate objectives.DocumentsYou can access the ACER Paper providing Examples of Calculation for CO2 emission limits here.You can access the ACER Opinion here​.​"	https://www.acer.europa.eu/Media/News/Pages/Decarbonising-the-power-sector-ACER-provides-further-guidance-on-CO2-emission-limits-.aspx
