id	date	title	text	url
ACER_NEWS_0227	2015-06-12	ACER launches a public consultation on the proposed methodology for monitoring the impact of the gas network codes on the internal market	 According to European legislation on conditions for access to the natural gas transmission networks, ACER has to monitor and analyse the implementation of the network codes and the Guidelines adopted by the European Commission. Today ACER launches a public consultation from 12 of June until 10 of July 2015 on the proposed methodology and invites EU stakeholders’ to share their views. The methodology has been developed by the Cambridge Economic Policy Associates (CEPA), which following an open procedure, was awarded a contract for consultancy services in the field of energy regulation. Comments proposing major improvements or pointing to factual mistakes will be taken into account and the Agency will request the CEPA to integrate those into their final study.You can access to the public consultation here. BackgroundThe European legislation on conditions for access to the natural gas transmission networks (Regulation (EC) No 715/2009) lays down rules for the Agency to monitor and analyse the implementation of the network codes and the Guidelines adopted by the Commission. Also, the Agency is responsible to assess the effect of codes in facilitating market integration, as well as on non-discrimination, effective competition and the efficient functioning of the market. The regulation also establishes that the Agency has to consult extensively with stakeholders in an open and transparent manner.	https://www.acer.europa.eu/Media/News/Pages/ACER-launches-a-public-consultation-on-the-proposed-methodology-for-monitoring-the-impact-of-the-gas-network-codes-on-the-i.aspx
ACER_NEWS_0228	2015-06-03	ACER Publishes a List of Twenty-five Pre-registered Reporting Mechanisms (RRMs)	" Under the EU Regulation on Wholesale Energy Market Integrity and Transparency (REMIT) aiming to prevent market manipulation and trading based on inside information, market participants have to report their wholesale energy records of transactions, including orders to trade, directly to ACER. During the first phase of reporting details of wholesale energy products at organised market places to the Agency as of 7 October 2015, market participants shall report their records of transactions, including orders to trade, through the organised market places concerned, or through trade matching or trade reporting systems as reporting channels – the so-called third party Registered Reporting Mechanisms (RRMs). ACER has published today a list of pre-registered third party RRM applicants for the first phase of reporting, which are in the final registration stages.   Third-party RRMs are organised market places, trade matching and trade reporting systems, including trade repositories, as well as the ENTSOs for the reporting of fundamental data. The list contains all the third-party RRM applicants which have received an ACER code following the completion of initial administrative checks of their registration.   These prospective RRMs will be registered as soon as they submit the required documents and pass the subsequent technical IT testing stage using a web interface. After the testing, the applicants have to send a test report to the Agency.   The Agency is looking forward to receiving the documents and the first test reports from the applicants, which the Agency will process as soon as they arrive. The successful RRMs will then be approved and included in the list of RRMs, which will be published. While the submission of documents is taking longer than anticipated, the publishing of the list of RRM applicants, which have passed the first registration stages, provides transparency to European market participants on the most advanced RRM applicants, allowing them to prepare for entering into a data reporting agreement.   The Agency welcomes initiatives for standard data reporting agreements for European market participants with organised market places, especially if they are RRM neutral and comply with the requirements of competition law. The RRM applicants which have passed the first registration stages are only the spearhead of RRM applicants. 35 additional third-party RRMs and more than 250 market participant RRMs are currently being processed, the latter for the second phase of data reporting as of 7 April 2016.   Background The Agency’s Market Monitoring Department is performing a number of activities that are a key to the smooth implementation of REMIT, and the coming into force of the trade data reporting obligations from 7 October 2015. The Department supported National Regulatory Authorities (NRAs) so that they were able to meet their deadline for starting the registration of market participants by 17 March 2015. In parallel, the Agency has continued the development of IT services for data collection, data sharing and market monitoring, and the initial assessment and coordination of activities on an increasing number of potential market abuse cases.   Even with the limited human resources currently available to the Agency, it has provided all third-party RRM applicants with support through webinars and telephone calls.  However, delays in the registration process have occurred, despite new arrangements being put in place to streamline some other procedures. In particular, a new procedure has been introduced to address the increasing number of stakeholder questions in monthly updates of the Agency's Q&A paper on REMIT, rather than replying to them individually.   Alberto Pototschnig, Director of ACER, said: ""Since REMIT came into force in 2011, the Agency has been asking, unsuccessfully, for additional staff commensurate to the challenge of implementing the new monitoring framework for effectively monitoring the EU wholesale energy markets. So far we have managed to progress in the implementation of REMIT despite our very limited resources, also thanks to a longer gestation of the REMIT Implementing Acts. But now, with the start of data reporting approaching, it is inevitable that the impact of the current resource shortage becomes visible, with some processes involving NRAs and other stakeholders being delayed. We are trying to minimise any disruption and we remain committed to our mission under REMIT to ensure greater transparency and integrity of the European wholesale energy markets in order to foster open and fair competition for the benefit of final energy consumers. We hope that we will soon be in a position to pursue this goal with adequate resources"".   Access the ACER press release here."	https://www.acer.europa.eu/Media/News/Pages/ACER-Publishes-a-List-of-Twenty-five-Pre-registered-Reporting-Mechanisms-(RRMs).aspx
ACER_NEWS_0229	2015-06-02	ACER and ENTSO-E step up efforts to ensure effective engagement of stakeholders in the Network Code implementation process	 ACER and ENTSO-E announced today that the feedback received from EU electricity stakeholders will soon be channelled through three specific committees, one per family of codes (Market Codes, Operational Codes and Connection Codes). The committees, chaired by the Agency, will engage interested parties. Relevant European associations, in particular, are envisaged to play an active role in the process. The initiative comes from the evaluation of the results of a public consultation launched by the Agency and ENTSO-E at the end of last year on how to ensure effective stakeholder participation in the forthcoming Network Code (NC) implementation process. ACER will publish a call in July for interested parties to join the Market Stakeholder Committee, which is expected to meet for the first time in September. In their draft Terms of Reference, both the Agency and ENTSO-E acknowledge the importance of the challenge for the European electricity sector to ensure implementation and compliance with the NCs across Europe, emphasising the importance of effective stakeholder engagement for the overall success of the NC implementation process. The European Stakeholder Committees (ESCs) shall in particular contribute to: monitoring the NC implementation process; achieving a more informed decision-making process for the methodologies and rules still to be developed. “ACER, ENTSO-E, Nominated Electricity Market Operators (NEMOs) and other parties responsible for the NC implementation are committed to collaborate in an open, transparent and timely manner within the new committees”, according to the terms of reference. The Agency and ENTSO-E are also ready to enhance stakeholder engagement both at regional and national level through their constituencies in the Member States.   Find out more in ACER Press Release. 	https://www.acer.europa.eu/Media/News/Pages/ACER-and-ENTSO-E-step-up-efforts-to-ensure-effective-engagement-of-stakeholders-in-the-Network-Code-implementation-process.aspx
ACER_NEWS_0230	2015-05-29	ACER finds still existing contractual congestion in European Gas Networks	 Contractual congestion, a situation where gas capacity demand exceeds the technical capacity, has been detected at about 15% of entry and exit sides at interconnection points (IPs) across the EU. The Agency’s annual congestion report​’s main outcome is reflected in a list specifying at which interconnection points the so-called Firm Day-Ahead Use-It-Or-Lose-It (FDA UIOLI) mechanism will have to be applied as a congestion management procedure (CMP) from July 2016 on, if congestion is still found in next year’s report. The report analyses transport, Congestion Management Procedures and capacity booking data from ENTSOG’s Transparency Platform (TP) for the period 2014 until 2016, as well as 2014 auction data from the PRISMA capacity booking platform.   ACER’s main findings •    How much congestion? Contractual congestion was identified at 32 IP sides and 4 bundles (i.e. a combination of exit and entry), for 13 of the IP sides for a second time. Congestion was mainly found by the non-offer of firm products with duration of at least one month, but also by the occurrence of auction premia.   •  Where? Most contractual congestion was found in the -South/South-East region, followed by the South region. In the North-West region the detected congestion is mitigated by active secondary trading and CMP application resulting in firm day-ahead capacity offers.   •    Is there progress? CMPs are increasingly applied at IPs in the European Union. Together with the use of interruptible capacity and secondary capacity trading, contractual congestion was alleviated in some cases.   •    What comes next? 24 congested individual IP sides (and 2 bundles) of the 257 IP sides assessed, have not yet implemented the FDA UIOLI and should potentially do so depending on the outcome of next year’s congestion report.   ACER’s main recommendations •    Improve data reliability: Although progress on transparency and data availability on ENTSOG’s TP - as far as relevant for the congestion report - has been made, TSOs and ENTSOG are requested to ensure that all data are fully available on the TP, reliable, checked and consistent (e.g. with PRISMA auction data).   • Refining congestion definition: ACER requests the Commission to consider clarifying the case of “congestion” when firm monthly capacity is not offered every month, since the current reading of the CMP Guidelines suggests that an IP is not considered congested if at least one single monthly product is offered. ACER Gas Contractual Congestion Report 2015 	https://www.acer.europa.eu/Media/News/Pages/ACER-finds-still-existing-contractual-congestion-in-European-Gas-Networks.aspx
ACER_NEWS_0231	2015-05-08	Walter Boltz appointed as Vice-Chairman of ACER Board of Regulators	" ACER’s Board of Regulators (BoR), who met in Brussels for the 47th time, have reappointed Walter Boltz (E-CONTROL) as their Vice Chairman. The new term of office is for two and a half years as of  6 May 2015.Vice-Chairman Walter Boltz, who is also the Chairman of the Agency's Gas Working Group, remarked that: ""In the coming years, European regulators will be faced with the challenge of contributing to the building of an Energy Union and its closely interelated dimensions which remain at the heart of ACER's work. I look forward to working with the BoR colleagues to meet this challenge."" The next Board of Regulators will be held in Brussels on June 10th 2015."	https://www.acer.europa.eu/Media/News/Pages/Walter-Boltz-appointed-as-Vice-Chairman-of-ACER-Board-of-Regulators.aspx
ACER_NEWS_0232	2015-05-07	ACER launches its Annual Conference 2015: An Energy Union for Consumers	" ACER invites you to register for its IV Annual Conference, which will focus on how to achieve ""An Energy Union for Consumers”. The event will take place at the Brdo Congress Centre near Kranj, Slovenia, on Thursday, 9th July 2015.   Following the publication of the European Commission’s Energy Union strategy, the ACER Annual Conference will aim at identifying the benefits that this strategy will be able to deliver to EU energy consumers. Both European Commission Vice-President for the Energy Union Maroš Šefčovič and Commissioner for Climate Action and Energy Miguel Angel Arias Cañete have confirmed their presence at the Conference. Following the welcome addresses on behalf of the Host Country, the European Parliament and the Luxembourgish Presidency of the Council of the EU, the Conference will be structured in three sessions focusing on how the Energy Union can ensure a new deal for consumers, how it can contribute to the integration of wholesale markets, as well as on the role of ACER within the Energy Union framework. Find out more and register until 29 June in ACER’s dedicated website​. "	https://www.acer.europa.eu/Media/News/Pages/ACER-launches-its-Annual-Conference-2015-An-Energy-Union-for-Consumers.aspx
ACER_NEWS_0233	2015-04-30	ACER invites stakeholders to provide input for the Agency’s 2016 work programme	 Alberto Pototschnig, Director of the EU Agency for the Cooperation of Energy Regulators will present the draft Work Programme of the Agency for 2016, currently in the drafting process, at a workshop in Ljubljana on 3 June 2015. All interested parties are invited to express their views and share their opinions on which areas the Agency should focus its effort on next year. You can register for the workshop here.  If you cannot attend in person you will be able to join and participate via Adobe Connect.   The draft Work Programme of the Agency is to be finalized by 30 June, also on the basis of inputs received from interested parties. The Work Programme is then approved by the Board of Regulators and adopted by the Administrative Board by 30 September.	https://www.acer.europa.eu/Media/News/Pages/ACER-invites-stakeholders-to-provide-input-for-the-Agency%E2%80%99s-2016-work-programme-.aspx
ACER_NEWS_0234	NULL	ACER adopts a decision on the allocation of costs for the Lithuanian part of the Electricity Interconnection between Lithuania and Poland	 ACER’s decision on the allocation of costs for the Lithuanian part of the Electricity interconnection between Lithuania and Poland (LitPol link), published today, indicates that, although this interconnection provides benefits to several Member States beyond Lithuania, the latter, as a net beneficiary of the project, does not need financial compensations for the investment from the other Member States benefiting from the project under the Cross-Border Cost Allocation (CBCA) framework. LitPol is one of the Projects of Common Interest (PCIs) identified by the EU to strengthen the continent’s energy infrastructure. PCIs benefit from an improved regulatory regime, including the possibility for Project Promoters to submit a CBCA request.  ACER decides on the allocation of costs (CBCA decisions) for a given PCI when the National Regulatory Authorities (NRAs) of the concerned Member States are unable to reach an agreement within six months of the request.   On 28 November 2014, ACER was informed that no agreement had been reached on CBCA for the LitPol Link among the NRAs of Finland, Germany, Latvia, Lithuania, Norway, Poland and Sweden, to which the Project Promoter, Litgrid AB, submitted an investment request, including a request for CBCA. ACER’s decision is based on a thorough review of the cost-benefit analysis and the identified impacts of the project (including on tariffs) provided by the Project Promoter, and on further information received from the Project Promoter and the NRAs and TSOs of the involved Member States in response to ACER requests and during ACER’s hearings. What is the project about? The LitPol Link connects the Lithuanian town of Alytus to the border with Poland (PCI 4.5.1) with 500 MW transfer capacity. Together with some related investments on the Polish side, LitPol aims at connecting the Lithuanian and Polish electricity systems, as well as the Baltic power system to Continental Europe, enabling energy transfer between these regions. By doing so, LitPol Link facilitates market integration and efficient market functioning, enhances energy security, and overall contributes to the stability and economic growth of Member States in the Baltic region.   Litgrid AB, the Project Promoter of the LitPol link, is the Transmission System Operator (TSO) of Lithuania. The company operates the Lithuanian electricity transmission network and is in charge of the transmission of electricity. Find out more in ACER Press Release here.    	https://www.acer.europa.eu/Media/News/Pages/ACER-adopts-a-decision-on-the-allocation-of-costs-for-the-Lithuanian-part-of-the-Electricity-Interconnection-between-Lithua.aspx
ACER_NEWS_0235	2015-04-23	ACER presents progress on common gas rules at the Madrid Forum	 In the frame of The Madrid Forum, which took place on 20 and 21 April, ACER reaffirmed its appreciation for the European Commission’s Energy Union communication as an opportunity to move EU energy policy into a higher gear to address common challenges. In this context ACER presented the progress made with regard to the Gas Target Model and supported cross-border cooperation under the regional initiatives. ACER actively took part in the debates on the network codes also addressed by the Forum.    ACER presented the recently published Gas Target Model - Review and Update, and provided an implementation plan, including the process for the calculation of the metrics for each wholesale market, and the self-evaluation process of the NRAs. Progress of the regional market integration pilot projects was also presented. Stakeholders welcomed the concrete examples, and discussed in particular the number of liquid hubs eventually needed in an integrated European gas market.    On Tariffs, ACER showed its commitment to continue the constructive dialogue with ENTSOG and the Commission. ACER is convinced that the cost allocation methodologies are at the heart of the Network Code. This topic should be tackled now and not be postponed to a later point in time. Improvements to the submitted Network Code, in line with ACER's Reasoned Opinion,  should be made in particular regarding limiting options in the outlined methodologies foreseen in the ENTSOG draft Network Code. Furthermore, ACER presented the preliminary results of this year's congestion report at the Madrid Forum planned to be published by 1 June 2015. Two examples of good cross-border cooperation were presented as case studies by the National Regulatory Authorities (NRAs) of the Netherlands and Austria (ACM and E-Control). ACER also called on NRAs and Transmission System Operators (TSOs) to prepare for implementation of the “firm day ahead use it or lose it” at those IPs identified as repeatedly congested in the ACER congestion report.   The implementation date for the Capacity Allocation (CAM) Network Code is fast approaching. The three existing booking platforms are urged to step up their efforts to implement a cooperation model by 1 November 2015. ACER will assess whether the chosen models are legally compliant and fully operational. ACER will furthermore conduct an analysis of the existing booking platforms to assess whether they all comply with the relevant provisions of the CAM Network Code.   The Madrid Forum was created by the European Commission to discuss issues regarding the creation of the internal gas market. Participants include ACER, NRAs, EU national governments, the Energy Community Secretariat, TSOs, gas suppliers, traders and producers, consumers, network users, and gas exchanges.   You can find the presentations of the Madrid Forum here. 	https://www.acer.europa.eu/Media/News/Pages/ACER-presents-progress-on-common-gas-rules-at-the-Madrid-Forum.aspx
ACER_NEWS_0236	2015-04-01	ACER calls for comments on the Network Code on Emergency and Restoration	 By the end of March the Agency received from ENTSO-E the Network Code on Emergency and Restoration, including its supporting document. This Network Code aims at achieving, maintaining and restoring a satisfactory level of operational security of the interconnected transmission systems in real time, to support the efficient functioning of the European internal electricity market, and to allow the integration of renewable energy sources.The Agency invites all interested stakeholders to express in writing their views on the Network Code on Emergency and Restoration. Find out more here.	https://www.acer.europa.eu/Media/News/Pages/ACER-calls-for-comments-on-the-Network-Code-on-Emergency-and-Restoration.aspx
ACER_NEWS_0237	2015-03-31	ACER launches today a quarterly on REMIT for further guidance	 The first issue of ACER’s REMIT Quarterly published today provides guidance on the applications of REMIT and other transaction reporting issues. The REMIT Quarterly, to be published four times a year, will provide up-to-date guidance on definitions, present new common understandings of Transaction Reporting Manual and cover other transaction reporting issues. Among other contents, this first edition presents a new Guidance Note that the Agency has produced with the aim to further clarify the application of the concept of a Person Professionally Arranging Transactions (PPAT). It furthermore presents the REMIT Reporting User Package in detail. Once REMIT is fully implemented, ACER will be responsible for collecting and analysing wholesale markets and other relevant data to identify possible instances of market abuse. Find out more here. 	https://www.acer.europa.eu/Media/News/Pages/ACER-launches-today-a-quarterly-on-REMIT-for-further-guidance-.aspx
ACER_NEWS_0238	2015-03-31	ACER invites ENTSOG to align further the Network Code on Harmonised Transmission Tariff Structures with the Framework Guidelines	 ACER published yesterday its opinion assessing the Network Code on Harmonised Transmission Tariff Structures for Gas. The opinion acknowledges the openness of the process carried out by ENTSOG as well as improvements in terms of structure and details. However ACER invites ENTSOG to amend the Network Code further to address misalignments with the Framework Guidelines. Subsequently to ENTSOG’s submission of a revised Network Code, the Agency will consider recommending it the European Commission. Progress achieved The Agency acknowledges the significant work undertaken by ENTSOG in developing the Network Code.  In particular, the Agency values the openness of the process led by ENTSOG that allowed contributions from the stakeholders and good cooperation with the Agency. In reviewing the Network Code the Agency recognises some improvements in the Network Code, compared to the Framework Guidelines, in terms of structure and details. However, on a significant number of substantive issues, the Agency has serious concerns about the content of the Network Code as submitted. Further improvements to be made The Agency’s main concerns regard the scope of the Network Code and in particular the definition of transmission services, publication requirements, the description of the various cost allocation methodologies, the approach to payable price, the conclusions of the impact assessment on the harmonisation of the tariff setting year, the pricing of interruptible capacity and non- physical backhaul capacity, and incremental capacity. Find out more here.	https://www.acer.europa.eu/Media/News/Pages/ACER-invites-ENTSOG-to-align-further-the-Network-Code-on-Harmonised-Transmission-Tariff-Structures-with-the-Framework-Guide.aspx
ACER_NEWS_0239	2015-03-25	Lord Mogg reappointed as Chairman of ACER Board of Regulators	 ACER’s Board of Regulators (BoR), who met today in Ljubljana for the 46th time, have reappointed Lord Mogg (OFGEM) as their Chairman for a new term of office of two and a half years starting in May 2015.   Following his reappointment, Lord Mogg said: “ACER has won great admiration for its work from its beginning some five years ago. In the Board of Regulators the collaboration between NRAs themselves and with Agency staff has been of the highest order. It is crucial to reinforce this cooperation and to enhance the complementarity of national and EU regulatory responsabilities. It is indeed a great honour to continue my chairmanship and to contribute to the Agency’s important work to deliver a truly integrated EU energy market”.   The next Board of Regulators will be held in Brussels on 6th May 2015. 	https://www.acer.europa.eu/Media/News/Pages/Lord-Mogg-reappointed-as-Chairman-of-ACER-Board-of-Regulators.aspx
