id	date	title	text	url
ACER_NEWS_0128	2017-11-16	Second ACER Report on the implementation of the Balancing Network Code available online	" The Agency publishes today its second Report on the implementation of the Balancing Network Code​, which sheds light on the different features of balancing design. Rules on gas balancing aim at facilitating gas trading across European Union balancing zones and at contributing to the development of short-term markets and their liquidity. Harmonised Union-wide rules on balancing have the objective to create an appropriate environment for network users to manage their balance positions in the different balancing zones of the Union in an economically efficient and comparable way.  The Report describes the status of the implementation and application of the Code across the EU Member States. The Code is applicable since 1 October 2015. The implementation challenge is greater for those Member States that have not yet enabled short-term markets. For its second Report, the Agency developed a new Balancing Analytical Framework to allow effective balancing regime comparison by quantifying the performances for the balancing regimes of National Grid Group (GB-UK), the H-Cal Zone Fluxys (BeLux), NCG (Germany), Energinet.dk (Denmark), GRTgaz Nord (France), Plinovodi (Slovenia) and Enagas (Spain). This year, the Agency has also acquired a better understanding about a broader set of balancing regimes, including the ones most lagging behind (Romania, Bulgaria and Greece). In addition the Report aims to continue the assessment of the various balancing regimes across the EU. In this context, it presents the results of an enhanced review of the country assessments for 26 balancing zones, updated for this year, using the same evaluation framework as last year  Main findings:​ The implementation of the Code is still patchy: some regimes are in a well-developed stage, while others have made some or no progress at all. NRAs and TSOs should work together with market players to progress the implementation of the Balancing Code by promoting greater access to short-term commercial opportunities, lively trading platforms, and revision of the limited access to transit infrastructures. 	 Consumer benefits can only be reaped where markets work effectively. The Agency promotes the use of the Balancing Analytical Framework to assess balancing regime effectiveness and further the evolution of these regimes. 	 The Balancing Analytical Framework builds strongly on analysing neutrality, which is a key indicator to understand robust gas accounting and wider regime performance. Another aim of the Balancing Analytical Framework is to make initial steps to understand the underlying relationship between the physical linepack -volume of gas in the system at a given point in time- and commercial imbalances, the latter including both TSO actions and network users imbalances, to help improve the effectiveness of the operational regime. 	 The Agency looks forward to acquiring good information for all the indicators used in the Report to enable future monitoring, including better linepack information. The Agency requests that ENTSOG facilitates the usage of the Balancing Analytical Framework and the collection of the relevant data applied by this framework.Useful Links: Balancing page on Network Code and code developmentFirst ACER report and Early Implementation Reports         First ACER Report on the implementation of the Balancing Network Code on 7 November 2016 Second ACER-ENTSOG Report on the status of the implementation of the Balancing Network Code on 5 November 2015         ACER-ENTSOG Report on the early implementation of the Balancing Network Code (BAL NC)​ on 22 October 2014 ​​​"	https://www.acer.europa.eu/Media/News/Pages/Second-ACER-Report-on-the-implementation-of-the-Balancing-Network-Code-available-online.aspx
ACER_NEWS_0129	2017-11-07	ACER publishes its first Implementation Monitoring Report on Requirements for Generators	 In the first implementation monitoring report​ of its kind, the Agency finds that implementation of the Network Code on Requirements for Grid Connection of Generators (NC RfG) is well on track. However, full implementation is still outstanding in the areas of the publication of criteria for granting derogations and the transitional arrangements for emerging technologies. The basis for this assessment is the non-binding guidance on implementation by ENTSO-E and the list of the relevant information for implementation monitoring by the Agency.    Based on National Regulatory Authorities (NRAs) answers to questionnaires and detailed analyses, the first Implementation Monitoring Report of the Network Code on Requirements for Grid Connection of Generators delivers the following recommendations:   ​Granting derogations: the Agency understands NRAs may amend the criteria for granting derogations once per year at the most. The Agency recommends that, in doing so, NRAs take into account best practice, as shared in the framework of the Agency.    Transitional arrangements for emerging technologies: the Agency recommends NRAs to coordinate any withdrawal of classification as emerging technology with other NRAs, using the framework of the Agency. Also, the Agency recommends that the cumulative maximum capacity of power-generating modules classified as emerging technologies for each Member State be published on a dedicated website. All NRAs and/or other authorities, where applicable in Member States, should commit to provide the Agency with relevant information on a regular basis.    NRA empowerment: the lack of NRA empowerment for the approval and withdrawal of classification as emerging technology influences the efficiency of coordination at the Synchronous Area level. Therefore, the Agency urges MSs to empower their NRAs for the approval and withdrawal of classification as emerging technology, so as to ensure that all relevant information is taken into account when deciding on the approval and withdrawal of classification as emerging technology.Access the report here​.     ​	https://www.acer.europa.eu/Media/News/Pages/ACER-publishes-its-first-Implementation-Monitoring-Report-on-Requirements-for-Generators.aspx
ACER_NEWS_0130	2017-10-24	Households and businesses benefit from falling EU energy prices	 Electricity and gas retail prices generally fell in the EU for both household and industrial consumers. European households paid 8.4% less for their gas in 2016 compared to 2015, mostly thanks to improved gas markets, while the electricity household prices went down by 2.1% - first registered decrease for households since 2008 - thanks to the steady decline of electricity wholesale prices in recent years.  The Annual Report on the Results of Monitoring the Internal Electricity and Natural Gas Markets​ was presented today in Brussels by the Agency for the Cooperation of Energy Regulators (ACER) and the Council of European Energy Regulators (CEER). For the first time, the Report includes some data on the Energy Community Contracting Parties.  Barrier to further EU energy market integration still persist  EU energy prices fell thanks to improved gas market functioning, among other factors, and despite limited capacity available for electricity cross-border trading. Hence, European energy regulators see opportunities for further benefits for EU energy consumers. For example, electricity Transmission System Operators (TSOs) should make a larger share of the existing cross-border capacity available for trading, given that only half of what is technically possible is offered today to the market.   Commenting on this significant barrier to market integration, Alberto Pototschnig, ACER Director, called for “more TSO coordination and the equal treatment of intra-zonal and cross-zonal exchanges of power, so as to deliver additional benefits to consumers”.   Gas markets are working better in terms of hub functioning and price convergence, with the volume of hub-traded gas increasing by 20% from 2015 to 2016. But, important barriers remain, in particular in South-East Europe, that negatively affect market functioning and liquidity.  Whilst the EU gas network codes are making a difference for the better, market conditions, including oversupply and overcapacity, limit their impact. Further TSO and NRA coordination on network codes implementation will enhance market integration.  Switching supplier should be even faster and reliable comparison tools are needed  Consumer protection and empowerment rights are generally well established. Disconnection rate are about 1% (for electricity and gas). The time it takes to switch supplier has improved (now 12 working days), but is still longer than the 24-hour switching period that regulators would like to see, and it takes 5-6 weeks to receive the final bill after switching supplier.    Smart meter roll across Europe is low (25% of electricity households and only 4 countries for gas) and not enough countries have reliable comparison tools (22 in electricity and 18 in gas). Lord Mogg, Chair of ACER’s Board of Regulators and CEER President, said: “Consumers’ empowerment is essential. Reliable comparison tools are a must. Switching within 24-hours is the target. Bills must be kept simple and smart meters must have minimum functionalities that deliver benefits for consumers”.  The Energy Community Secretariat’s Director Janez Kopač said: “The present report, which for the first time also encompasses Contracting Parties of the Energy Community, brings us closer in the realisation of the pan-European Energy Union. Internal energy market integration efforts must not stop at the EU’s borders and this report is a stepping stone in the construction of the Energy Union's governance”. 	https://www.acer.europa.eu/Media/News/Pages/Households-and-businesses-benefit-from-falling-EU-energy-prices.aspx
ACER_NEWS_0131	2017-10-06	Continued gas wholesale market integration, but electricity market integration at risk	 The latest ACER-CEER Market Monitoring Report (MMR), whose wholesale and retail volumes were published today, shows that for electricity wholesale markets the limited amount of cross-zonal capacity made available for trading by TSOs is one of the most significant barriers to further market integration in Europe. Ensuring the equal treatment of internal - within bidding-zones - and cross-zonal exchanges, as well as increasing the level of TSO coordination, are utmost priorities to overcome this situation.  Gas markets are working better in terms of hub functioning and price convergence, but the situation is diverse geographically. Important barriers remain in some Member States, in particular in South-East Europe, negatively affecting market functioning and liquidity.  The gas network codes, where implemented, bring a positive impact.  The downward trend of wholesale energy prices (both electricity and gas) continued in most of the EU in 2016. Retail prices are also showing more and more a downward trend. For electricity for industrial consumers and for gas, this has already been the case for a couple of years, but this now also extends to electricity household prices.  This MMR also covers the Energy Community Contracting Parties for some retail and gas wholesale topics, thanks to the support and cooperation of the Energy Community Secretariat. Industrial electricity and gas prices in these countries tend to be higher than household prices, with an upward trend for households and a downward one for industrial consumers.  The results of the MMR will be presented in Brussels on October 24th. Registration can be done via the ACER website. The links to the Electricity wholesale markets, gas wholesale markets and electricity and gas retail volumes can be found here​. 	https://www.acer.europa.eu/Media/News/Pages/Continued-gas-wholesale-market-integration,-but-electricity-market-integration-at-risk.aspx
ACER_NEWS_0132	2017-10-05	ACER launches a Public Consultation on the revision of electronic formats for reporting under REMIT	 ​The Agency invites all interested parties involved in data collection under the EU Regulation on wholesale energy market integrity and transparency (REMIT) to provide their views on the proposed changes to the electronic (XML) formats that are currently used for the reporting of transaction data, fundamental data and inside information to the e-mail address Remit.PublicConsultations(at)acer.europa.eu by 8 December 2017. The Public Consultation document is available here. 	https://www.acer.europa.eu/Media/News/Pages/ACER-launches-a-Public-Consultation-on-the-revision-of-electronic-formats-for-reporting-under-REMIT.aspx
ACER_NEWS_0133	2017-09-25	ACER Work Programme for 2018 is available online	 The Agency’s 2018 Programming Document, which includes the 2018 Work Programme, was published today, following its adoption last week by ACER’s Administrative Board. The document, which was previously approved by the Board of Regulators, is now available online here. As in previous years, the document is structured according the format of the Programming Document for EU Agencies. The Agency’s multiannual outlook for the 2018 – 2020 period has been updated, but remains fully consistent with the one published last year. Pending the adoption and the entry into force of the legislative acts of the Commission’s “Clean Energy for all Europeans” package, the Agency’s legal mandate and priorities remain, for the time-being, the same as those in 2017. The document thus focuses on the four main areas on which the Agency expects to concentrate its activities: the (post-2014) completion of the Internal Energy Market, the infrastructure challenge, the monitoring of wholesale energy markets and the longer-term regulatory challenges such as the integration of renewables.  As an innovation with respect to previous years, however, the tasks in the 2018 Work Programme have been classified according to three priority levels (critical, important and relevant). As in 2017, the monitoring of trading in EU wholesale energy markets on the basis of the reported trade and fundamental data remains one of the Agency’s main challenges. The Agency’s effectiveness in such a monitoring activity continues to depend crucially on it being assigned the significant additional resources that it has been requesting since 2014, and which the Agency is again requesting for 2018.  Access all the work programmes of the Agency here. 	https://www.acer.europa.eu/Media/News/Pages/ACER-Work-Programme-for-2018-is-available-online.aspx
ACER_NEWS_0134	2017-09-22	Members of the EU Parliament visit ACER	 A delegation from the European Parliament’s Committee for Transport, Research and Energy (ITRE) visited ACER’s headquarters yesterday in Ljubljana. The delegation discussed the Agency’s work towards a single, well-functioning and transparent energy market in Europe.          The delegation was led by Mr Morten Helveg Petersen, MEP, from the Alliance of Liberals and Democrats (ALDE) and Vice Chair of the ITRE Committee and also included Mr Miroslav Poche, MEP, from the Socialists and Democrats.   The discussions focused on the implementation of the network codes and guidelines in the gas and electricity sectors, the Clean Energy Package proposals, the Energy Infrastructure Package, and the implementation of REMIT (Wholesale energy market integrity and transparency).          The ITRE Committee delegation also held a joint session with ACER’s Administrative Board.         At the meeting, Alberto Pototschnig, Director of the Agency, expressed his appreciation and gratitude for the continued support of the European Parliament, and of the ITRE Committee in particular, to the Agency over these years.                  	https://www.acer.europa.eu/Media/News/Pages/Members-of-the-EU-Parliament-visit-ACER0922-9045.aspx
ACER_NEWS_0135	2017-09-18	Mr Garrett Blaney appointed as the next Chairman of the Agency’s Board of Regulators	 The Agency’s Board of Regulators (BoR), at its 68th meeting, have elected today Mr Garrett Blaney as their next Chair. He is a Commissioner at the Commission for Energy Regulation (CER), in Ireland. He will succeed Lord Mogg as of 6 November 2017 for a term of office of two and a half years (renewable).       Following his appointment, Mr Blaney commented: “It is an honour to have been appointed as the new Chair of the Agency’s Board of Regulators and to be able to build on the impressive work by Lord Mogg and to contribute to its ambitious goal of delivering a truly integrated EU energy market that works for all European energy consumers. Once adopted, the Clean Energy Package will expose European regulators to new challenges, but also give us new momentum. I am confident that we will meet those challenges through enhanced collaboration”.     Mr Pototschnig, the Agency Director, commented: “I warmly congratulate Mr Blaney on his election as the next Chair of the Agency's Board of Regulators from November and I look forward to working with him to lead the Agency through the challenging times ahead of us. At the same time, I would like to express my sincere gratitude to Lord Mogg, who has served as the first Chair of the Board of Regulators over the last seven and a half years. During this period he has been instrumental in the successful establishment and growth of the Agency. I have thoroughly enjoyed our cooperation and I am grateful for his support and for the many occasions when I was able to rely on his wisdom and advice”.            	https://www.acer.europa.eu/Media/News/Pages/Mr-Garrett-Blaney-appointed-as-the-next-Chairman-of-the-Agency%E2%80%99s-Board-of-Regulators.aspx
ACER_NEWS_0136	2017-09-08	Register for the 1st Energy Market Integrity and Transparency Forum	 The Agency is organising “The 1st Energy Market Integrity and Transparency Forum”, an event that will be held on 11 October 2017 in the Slovenian Forestry Institute in Ljubljana (Slovenia).      ACER would like to involve its main stakeholders and national authorities in this event. The REMIT Forum is organised with the support of the Slovenian Ministry of Foreign Affairs. The European Commission – Directorate-General for Energy will participate in the Forum.     The Forum will focus on REMIT policy topics (Q&A, Urgent Market Messages-UMMs, REMIT data quality etc.) and on the experience gained over the last two years (since data reporting started), as seen through the eyes of stakeholders. It will also focus on the way forward. Given the nature of the Forum, participation is limited.       You can show your interest in participating by registering here​.​           	https://www.acer.europa.eu/Media/News/Pages/Register-for-the-1st-Energy-Market-Integrity-and-Transparency-Forum.aspx
ACER_NEWS_0137	2017-08-30	Selection of the next ACER Director launched	 The European Commission has launched today the procedure for selecting the next Director of ACER, the European Union Agency for the Cooperation of Energy Regulators, as the second mandate of Alberto Pototschnig, the current Director of the Agency, comes to an end in September 2018. The Agency is based in Ljubljana, Slovenia.       The vacancy notice, describing the position, listing the requirements of the post and providing guidance on how to apply, is published on the Official Journal of the European Union (C 286 A) of 30 August 2017 and can also be accessed through the Agency’s website here​. The deadline for submitting the applications is 27 September 2017.      The next Director will take over from Alberto Pototschnig on 16 September 2018.                         	https://www.acer.europa.eu/Media/News/Pages/Selection-of-the-next-ACER-Director-launched.aspx
ACER_NEWS_0138	2017-08-30	ACER workshop on Harmonized Allocation Rules for long-term electricity transmission rights	 The Agency is organising a workshop in Ljubljana on 11 September on the main body of the Harmonized Allocation Rules (HAR) for long-term electricity transmission rights submitted by all TSOs in accordance with the EU Regulation establishing a Guideline on Forward Capacity Allocation. Harmonized Allocation Rules aim at creating a level-playing field across Europe.      The National Regulatory Authorities (NRAs) did not reach an agreement on the required credit rating for banks issuing collaterals for market participants and have requested ACER to take a decision.      You can register for the workshop here​.      Background      On 17 August 2017, the Agency received a letter on behalf of all NRAs requesting it to adopt a decision pursuant to Article 4(10) of Regulation 2016/1719 on the all Transmission System Operators (TSOs)’ proposal for HAR.      The point of disagreement among NRAs lies in the provisions of Article 21(1)h of the proposed HAR, concerning the required credit rating for banks issuing collaterals for market participants: while the TSOs’ proposal states that, in case of an industry-wide downgrade of financial institutions, the Allocation Platform may decrease the required rating below BBB+ for a limited period of time, one NRA would prefer instead either (i) to maintain the default required credit rating level BBB+ even though there is an industry-wide downgrade, or (ii) to delete all provisions of credit rating and leave the decision completely to TSOs.      On 26 August, in compliance with the provisions of Article 8(1) of Regulation (EC) 713/2009, the Agency launched a consultation among the national regulatory authorities and the transmission system operators concerned. This consultation will remain open until 8 September.      In addition, the Agency would also like to give other stakeholders a chance to provide comments on its proposal.      The Agency’s proposal for an amended version of the HAR is attached to this invitation. This version keeps the TSOs’ proposal as regards Article 21(1)h and includes a few other minor amendments (mainly for clarification and alignment with the Regulation 2016/1719) already communicated by NRAs early this year.       	https://www.acer.europa.eu/Media/News/Pages/ACER-workshop-on-Harmonized-Allocation-Rules-for-long-term-electricity-transmission-rights.aspx
ACER_NEWS_0139	2017-08-24	ACER consults on the maximum and minimum prices in the day-ahead and intraday coupling	 As of August 2017 the Agency has become competent to decide on the proposals for maximum and minimum prices in single day-ahead and intraday coupling developed by all Nominated Electricity Market Operators (NEMOs).                   In order to take an informed decision on these two proposals, the Agency seeks the comments of interested stakeholders on the Agency’s proposed amendments to the proposals, which intend to improve the compliance of the proposals with the EU Regulation on Capacity Allocation and Congestion Management for electricity (CACM). Other comments on the proposals are also welcome.  All interested stakeholders are invited to submit their comments by 15 September 2017, 23.59 hrs (CET).                The decision on these proposals will be taken in accordance with the CACM Regulation.                 More information this consultation can be find here​.                                   	https://www.acer.europa.eu/Media/News/Pages/ACER-consults-on-the-maximum-and-minimum-prices-in-the-day-ahead-and-intraday-coupling.aspx
